"ind","catg","headline","body","imageurl","readmoreurl","inblockId"
"541","technology","World's 1st robot citizen calls for Saudi women's rights ","The humanoid robot Sophia who became the world's first robot citizen in October this year after receiving Saudi Arabia's citizenship has called for women's rights in the kingdom. Notably, women in Saudi Arabia are not allowed to marry, divorce, travel or get a job without permission from their male guardians as per the country's law.","http://images.newsinshorts.com.edgesuite.net/app_assets/images/2017/7dec/inshorts_image_1512640501616_668.jpg?resize=400px:*","http://www.ibtimes.co.uk/saudi-arabias-first-robot-citizen-sophia-now-calling-womens-rights-kingdom-1650363?utm_campaign=soficalflowtwitter&utm_source=socialflowtwitter&utm_medium=articles&utm_source=inshorts&utm_medium=referral&utm_campaign=fullarticle ","w7e61mum-1"
"542","technology","I believe strongly in freedoms: Apple CEO Tim Cook","Talking about China's Internet policy, Apple CEO Tim Cook has said, ""I believe strongly in freedoms. They are at the core of what being an American is."" Adding that every country in the world decides their laws and regulations, he said that companies are left with a choice to either participate or stay on the sidelines.","http://images.newsinshorts.com.edgesuite.net/app_assets/images/2017/6dec/inshorts_image_1512562804497_547.jpg?resize=400px:*","http://fortune.com/2017/12/06/apple-tim-cook-china-internet-fortune-global-forum/?utm_source=inshorts&utm_medium=referral&utm_campaign=fullarticle ","w7e61mum-1"
"543","technology","Uber rival Lyft launches self-driving cars in Boston","Ride-hailing startup Lyft has launched its self-driving cars with the technology startup 'NuTonomy' in Boston, United States. The cars will be accompanied by human safety drivers to take control in case of an emergency. The ride-hail company is also working with self-driving car startup Drive.ai to deploy autonomous taxis in San Francisco city in the US. ","http://images.newsinshorts.com.edgesuite.net/app_assets/images/2017/7dec/inshorts_image_1512656564652_141.jpg?resize=400px:*","https://www.theverge.com/2017/12/6/16742924/lyft-nutonomy-boston-self-driving-car?utm_source=inshorts&utm_medium=referral&utm_campaign=fullarticle ","w7e61mum-1"
"544","technology","Apple names meditation app 'Calm' as iPhone app of the year","Technology giant Apple has named the meditation app 'Calm' as 2017's iPhone app of the year. The app, which is compatible with iOS 9.0 or later, offers guided meditation sessions, sleeping stories, breathing programs and relaxing music. Apple has also named the photo-editing app called 'Affinity Photo' as 2017's iPad app of the year.","http://images.newsinshorts.com.edgesuite.net/app_assets/images/2017/7dec/inshorts_image_1512655767272_930.jpg?resize=400px:*","https://www.apple.com/newsroom/2017/12/apple-reveals-2017-most-popular-apps-music-and-more/?utm_source=inshorts&utm_medium=referral&utm_campaign=fullarticle ","w7e61mum-1"
"545","technology","Exchange apologises after hackers steal Bitcoin worth $64 mn","The founders of Slovenia-based exchange NiceHash have apologised after about $64 million worth of Bitcoins were stolen from its wallet. ""Unfortunately, we became a target and someone really wanted to bring us down,"" NiceHash Founders Marko Kobal and Sasa Coh said. The attack had caused the company to shut down its website for 24 hours.","http://images.newsinshorts.com.edgesuite.net/app_assets/images/2017/8dec/inshorts_image_1512735642341_996.jpg?resize=400px:*","https://www.theverge.com/2017/12/7/16748472/nicehash-cryptocurrency-mining-bitcoin-ethereum-hacking-security-breach?utm_source=inshorts&utm_medium=referral&utm_campaign=fullarticle ","w7e61mum-1"
"546","technology","New 3D-printed plastics connect to WiFi without electronics","In a first, US-based researchers have 3D-printed plastic objects and sensors that can communicate with WiFi-connected devices on their own. The technology named ""printed WiFi"" uses the mechanical motion of springs and switches to reflect radio signals. It can have multiple applications, for example, sensing the detergent quantity left in a bottle based on flow rate and automatically order more.","http://images.newsinshorts.com.edgesuite.net/app_assets/images/2017/9dec/inshorts_image_1512792552384_496.jpg?resize=400px:*","http://www.washington.edu/news/2017/12/05/in-first-3-d-printed-objects-connect-to-wifi-without-electronics/?utm_source=inshorts&utm_medium=referral&utm_campaign=fullarticle ","w7e61mum-1"
"547","technology","Stay away from my kids Facebook: UK Health Secretary","UK's Health Secretary Jeremy Hunt has asked Facebook to stay away from his kids and act responsibly after the company launched 'Messenger Kids' in the US. Hunt said, Facebook promised to come up with ideas to prevent underage use of its product but instead, is ""actively targeting younger children."" ""Not sure this is the right direction at all,"" Hunt added.","http://images.newsinshorts.com.edgesuite.net/app_assets/images/2017/6dec/inshorts_image_1512569579827_522.jpg?resize=400px:*","https://www.theguardian.com/technology/2017/dec/05/jeremy-hunt-attacks-facebook-over-app-aimed-at-children?utm_source=inshorts&utm_medium=referral&utm_campaign=fullarticle ","w7e61mum-1"
"548","technology","Hackers steal $64 million worth Bitcoin from exchange","Slovenia-based exchange NiceHash has said that nearly $64 million worth of Bitcoins had been stolen from its wallet. A company executive said that over 4,700 Bitcoins were lost, adding that the hack was ""a highly professional attack with sophisticated social engineering"". NiceHash is a marketplace that matches people looking to sell processing time on their computers in exchange for Bitcoin.","http://images.newsinshorts.com.edgesuite.net/app_assets/images/2017/7dec/inshorts_image_1512652077918_202.jpg?resize=400px:*","https://www.reuters.com/article/us-cyber-nicehash/digital-currency-exchange-nicehash-says-bitcoin-worth-nearly-64-million-hacked-idUSKBN1E10AQ?utm_source=inshorts&utm_medium=referral&utm_campaign=fullarticle ","w7e61mum-1"
"549","technology","US court dismisses gender pay gap lawsuit against Google","A US court has dismissed a class action lawsuit which accused Google of paying female employees less than male counterparts. Adding that two of the three plaintiffs could not prove their claims, the court asked that a new complaint be filed for only specific groups of women affected by pay discrimination. It also observed that the lawsuit was too vague.","http://images.newsinshorts.com.edgesuite.net/app_assets/images/2017/7dec/inshorts_image_1512626148672_639.jpg?resize=400px:*","https://www.theverge.com/2017/12/6/16742506/google-sex-discrimination-lawsuit-vague?utm_source=inshorts&utm_medium=referral&utm_campaign=fullarticle ","w7e61mum-1"
"550","technology","No silver bullet to curb fake news, says Facebook head","While talking about curbing fake news, Facebook's Product Director Alexandra Hardiman has said that there is no silver bullet to achieve the same. However, she said that the company has taken steps to make sure that the misinformation is flagged and downlinked. She further added that the company has also put a lot of investment behind ad transparency.","http://images.newsinshorts.com.edgesuite.net/app_assets/images/2017/6dec/inshorts_image_1512569000271_829.jpg?resize=400px:*","http://www.livemint.com/Companies/F9NMrS9QSNrfUi6zARu0JK/Theres-silver-bullet-to-curb-fake-news-Facebooks-Alex-Har.html?utm_source=inshorts&utm_medium=referral&utm_campaign=fullarticle ","w7e61mum-1"
"551","technology","In 2 or 3 yrs we’ll have first flying taxis: Volocopter","Volocopter's Co-founder Alex Zosel has said that in two or three years the German aviation startup will have its first commercial applications ""somewhere in the world."" Zosel added that the first commercial application will be a 'point to point' solution over bottlenecks such as traffic congestions. The startup's aircrafts will fly at an airspeed of 100 kmph.","http://images.newsinshorts.com.edgesuite.net/app_assets/images/2017/6dec/inshorts_image_1512543929506_127.jpg?resize=400px:*","https://techcrunch.com/2017/12/05/volocopter-expect-our-flying-taxis-running-for-real-in-two-to-three-years/?utm_source=inshorts&utm_medium=referral&utm_campaign=fullarticle ","w7e61mum-1"
"552","technology","Designer makes scarf inspired by iPhone X","Germany-based designer Ceyhun Güney has made an 'iPhone X Scarf' which has a similar colour scheme as the default background of technology giant Apple's iPhone X smartphone. The scarf, which is priced at around ₹2,600 also features the 'notch' and the Apple logo on it. Interestingly, the iPhone X has a starting price of around ₹89,000.","http://images.newsinshorts.com.edgesuite.net/app_assets/images/2017/9dec/inshorts_image_1512807066004_471.jpg?resize=400px:*","http://mashable.com/2017/12/08/iphone-x-scarf-apple-fans/?utm_cid=hp-r-6&utm_source=inshorts&utm_medium=referral&utm_campaign=fullarticle#en5ffDRrWOqS ","w7e61mum-1"
"553","technology","Apple's Jony Ive retakes design team management after 2 yrs","Apple's Chief Design Officer Jonathan Ive has retaken the management of product design teams after two years, the company confirmed. Ive was promoted to the position in 2015 after which he gave up the day-to-day management responsibilities. ""With the completion of Apple Park, Apple's design leaders... are again reporting directly"" to Ive, who will remain focused on design, Apple said.","http://images.newsinshorts.com.edgesuite.net/app_assets/images/2017/9dec/inshorts_image_1512804969430_651.jpg?resize=400px:*","https://techcrunch.com/2017/12/08/jony-ive-is-leading-apples-design-team-again/?utm_source=inshorts&utm_medium=referral&utm_campaign=fullarticle ","w7e61mum-1"
"554","technology","Russia proposes criminalising cryptocurrency mining","Russia's Finance Ministry has proposed to criminalise cryptocurrency mining in the country's attempt to regulate the virtual currencies. ""If someone created the cryptocurrency for the purpose of settlements, then there will be a criminal punishment,"" the Finance Ministry said in a statement. However, buying Bitcoin and other cryptocurrencies would be legal, officials added.","http://images.newsinshorts.com.edgesuite.net/app_assets/images/2017/7dec/inshorts_image_1512649171594_134.jpg?resize=400px:*","https://www.rt.com/business/412132-bitcoin-cryptocurrencies-mining-russia/?utm_source=inshorts&utm_medium=referral&utm_campaign=fullarticle ","w7e61mum-1"
"555","technology","₹6,440 bracelet which also works as a phone charger made","US-based developer Charles Darius has developed a ₹6,440 bracelet called Bolt Charging Bracelet which also works as a phone charger. The device turns into a thin USB to Lightning cable, with a light pull allowing users to charge or sync their devices at convenience. However, the device is only compatible with Apple devices including iPhone, iPad and iPod. ","http://images.newsinshorts.com.edgesuite.net/app_assets/images/2017/6dec/inshorts_image_1512546701691_947.jpg?resize=400px:*","http://mashable.com/2017/12/05/iphone-charging-bracelet/?utm_source=inshorts&utm_medium=referral&utm_campaign=fullarticle#h0GTI_CarmqY ","w7e61mum-1"
"556","technology","Instagram account of cat with 1.7 million followers hacked","The Instagram account of a cat named 'Lil Bub', who has 1.7 million followers, has been hacked. Mike Bridavsky, who operates the account for the cat, claimed that the account was compromised for about an hour and has now been restored. The account was hacked by a teenager who changed its bio, and posted selfies and videos, Bridavsky said.","http://images.newsinshorts.com.edgesuite.net/app_assets/images/2017/8dec/inshorts_image_1512747115421_525.jpg?resize=400px:*","http://mashable.com/2017/12/07/lil-bub-instagram-hack/?utm_cid=hp-r-1&utm_source=inshorts&utm_medium=referral&utm_campaign=fullarticle#VI7hhoJC0mql ","w7e61mum-1"
"557","technology","EU urges Google, FB to do more to remove extremist content","The European Commission has said that Internet giants like Facebook, Google, YouTube, and Twitter must do more to prevent spreading of extremist content on their platforms. It also said that it will come forward with legislation if companies do not make progress on the issue. The Commission added that it favours a self-regulatory approach over a patchwork of national laws.","http://images.newsinshorts.com.edgesuite.net/app_assets/images/2017/7dec/inshorts_image_1512650475986_159.jpg?resize=400px:*","https://www.theguardian.com/technology/2017/dec/07/eu-warns-tech-firms-facebook-google-youtube-twitter-remove-extremist-content-regulated-european-commission?utm_source=inshorts&utm_medium=referral&utm_campaign=fullarticle ","w7e61mum-1"
"558","technology","FB COO Sheryl Sandberg reveals she was sexually harassed","In a Facebook post about sexual harassment faced by women, Facebook COO Sheryl Sandberg revealed that she also experienced sexual harassment over the course of her job. Adding that she was lucky she wasn't harassed by anyone she worked for, she said old, married men offered career advice and suggested they could share it with her alone late at night.","http://images.newsinshorts.com.edgesuite.net/app_assets/images/2017/4dec/inshorts_image_1512368174390_408.jpg?resize=400px:*","https://www.facebook.com/sheryl/posts/10159569315265177?utm_source=inshorts&utm_medium=referral&utm_campaign=fullarticle ","pvqj5uu2-2"
"559","technology","Apple agrees to pay Ireland $15.4 billion in back taxes","Technology giant Apple has agreed to pay Ireland $15.4 billion in back taxes, Ireland's Finance Minister Paschal Donohoe confirmed on Monday. The European Commission had ordered Apple to pay the sum last year, citing that the company received illegal tax benefits from the Irish government. Apple is expected to begin making the payments from the first quarter of next year.","http://images.newsinshorts.com.edgesuite.net/app_assets/images/2017/5dec/inshorts_image_1512453413654_775.jpg?resize=400px:*","https://www.theverge.com/2017/12/4/16736114/apple-ireland-european-union-order-back-taxes-agreement?utm_source=inshorts&utm_medium=referral&utm_campaign=fullarticle ","pvqj5uu2-2"
"560","technology","Google was not kicked out of China: Jack Ma","Talking about China being open to Western companies, Alibaba's CEO Jack Ma at a recent event said that Google left China and wasn't kicked out. In 2010, Google pulled its search and ads businesses from mainland China after refusing to censor content for the Chinese government. Google also discovered a number of hacking attacks on its servers during an investigation. ","http://images.newsinshorts.com.edgesuite.net/app_assets/images/2017/5dec/inshorts_image_1512474577835_982.jpg?resize=400px:*","https://www.bloomberg.com/news/articles/2017-12-05/jack-ma-says-china-open-to-western-companies-that-follow-rules?utm_source=inshorts&utm_medium=referral&utm_campaign=fullarticle ","pvqj5uu2-2"
"561","technology","Xiaomi seeks valuation of $50 billion in IPO: Report","Chinese smartphone maker Xiaomi is in talks with investment banks about an Initial Public Offering (IPO) and seeks a valuation of at least $50 billion, according to reports. The reports also suggested that Xiaomi is considering an IPO as early as the second half of 2018. Xiaomi last raised money in 2014 at a valuation of $46 billion.","http://images.newsinshorts.com.edgesuite.net/app_assets/images/2017/4dec/inshorts_image_1512387684366_787.jpg?resize=400px:*","https://www.bloomberg.com/news/articles/2017-12-04/xiaomi-is-said-to-seek-valuation-of-at-least-50-billion-in-ipo?utm_source=inshorts&utm_medium=referral&utm_campaign=fullarticle ","pvqj5uu2-2"
"562","technology","Volkswagen unveils electric minibus for app-based rides","German automaker Volkswagen's mobility services firm Moia has unveiled an electric six-seater minibus for app-based rides. The minibus will begin service in Germany's Hamburg city by the end of 2018, Moia's CEO Ole Harms said on Monday. The service will start with 200 vehicles and increase to about 1,000 in the following years, he said.","http://images.newsinshorts.com.edgesuite.net/app_assets/images/2017/4dec/inshorts_image_1512399200841_612.jpg?resize=400px:*","https://www.bloomberg.com/news/articles/2017-12-04/vw-unveils-electric-minibus-in-race-to-catch-ride-pooling-trend?utm_source=inshorts&utm_medium=referral&utm_campaign=fullarticle ","pvqj5uu2-2"
"563","technology","Developers earned $17bn from China App Store, says Apple CEO","Apple CEO Tim Cook on Sunday said that 1.8 million developers in China have earned nearly $17 billion (around 112 billion yuan) from the App Store till date. Cook shared the data during an event organised by the Cyberspace Administration of China. Earlier, Apple said that the developers had earned roughly $70 billion in revenue through the App Store.","http://images.newsinshorts.com.edgesuite.net/app_assets/images/2017/3dec/inshorts_image_1512302713351_726.jpg?resize=400px:*","https://in.reuters.com/article/apple-china/apples-tim-cook-says-developers-have-earned-17-billion-from-china-app-store-idINKBN1DX04L?utm_source=inshorts&utm_medium=referral&utm_campaign=fullarticle ","pvqj5uu2-2"
"564","technology","Technology almost irreversible at this point: Google CEO","While talking about technology, Google CEO Sundar Pichai has said, ""I think it's a big trend and I think it's almost irreversible at this point."" Adding that many businesses in China use Google to sell products to other countries, he said, ""Technology is giving opportunities at a global scale, driving interconnectedness and cooperation."" ","http://images.newsinshorts.com.edgesuite.net/app_assets/images/2017/3dec/inshorts_image_1512300068271_135.jpg?resize=400px:*","https://www.bloomberg.com/news/articles/2017-12-03/internet-must-have-security-humanity-apple-chief-tells-china?utm_source=inshorts&utm_medium=referral&utm_campaign=fullarticle ","pvqj5uu2-2"
"565","technology","Google brings 'Two-wheeler' mode to Maps in India","Google has launched the 'Two-wheeler' mode on Maps in India, a feature which will show the fastest route and directions to two-wheeler riders to reach their entered destination. The feature will be available alongside the 'Drive', 'Train or Bus', and 'Walk' options. The 'Two-wheeler' mode is currently available on Android smartphones.","http://images.newsinshorts.com.edgesuite.net/app_assets/images/2017/5dec/inshorts_image_1512476014492_184.jpg?resize=400px:*","http://indiatoday.intoday.in/technology/story/google-brings-two-wheeler-mode-to-maps-in-india-shows-fastest-routes-to-bikers/1/1103408.html?utm_source=inshorts&utm_medium=referral&utm_campaign=fullarticle ","pvqj5uu2-2"
"566","technology","World's first SMS was sent 25 years ago today","The world's first Short Message Service or SMS was sent by software programmer Neil Papworth from a computer 25 years ago today. The text, which was sent to a colleague on December 3, 1992, read ""Merry Christmas"". It was only in 1993 that Nokia introduced an SMS feature with a distinctive 'beep' to signal an incoming message.","http://images.newsinshorts.com.edgesuite.net/app_assets/images/2017/3dec/inshorts_image_1512296989691_210.jpg?resize=400px:*","http://www.bgr.in/news/worlds-first-text-message-was-sent-25-years-ago-today/?utm_source=inshorts&utm_medium=referral&utm_campaign=fullarticle ","pvqj5uu2-2"
"567","technology","Google bans Android apps that show ads on phone's lockscreen","Google has banned Android apps from the Play Store if they show ads on a phone's lockscreen. According to the technology giant, Android apps ""may not introduce features or ads that monetise the locked display of the specific device in which they are introduced"". However, this does not apply to the apps that are exclusively for lock screens.","http://images.newsinshorts.com.edgesuite.net/app_assets/images/2017/3dec/inshorts_image_1512320700788_724.jpg?resize=400px:*","http://mashable.com/2017/12/01/google-banning-ads-android-lockscreen/?utm_source=inshorts&utm_medium=referral&utm_campaign=fullarticle#2PBfxmd7xqqa ","pvqj5uu2-2"
"568","technology","WhatsApp to allow group admins to restrict other members","Facebook-owned messaging service WhatsApp is reportedly testing a feature to allow group administrators to restrict the activities of other members of the group. Once restricted, other members will not be able to send messages, photographs, videos, documents or voice messages. They will have to use the 'Message Admin' button to post a message or share media to the group. ","http://images.newsinshorts.com.edgesuite.net/app_assets/images/2017/3dec/inshorts_image_1512297957358_526.jpg?resize=400px:*","http://www.bgr.in/news/whatsapp-to-allow-group-admins-to-silence-reject-messages-from-members/?utm_source=inshorts&utm_medium=referral&utm_campaign=fullarticle ","pvqj5uu2-2"
"569","technology","Google launches Android Oreo Go edition for low-end phones","Technology giant Google has launched a lightweight Android Oreo Go edition operating system designed for devices with RAM up to 1 GB. According to Google, the Android Go offers 30% faster startup time and up to 2 times optimisation of storage space. There's also a Go version of the Play store with lightweight apps including YouTube Go and Gmail Go.","http://images.newsinshorts.com.edgesuite.net/app_assets/images/2017/5dec/inshorts_image_1512466500401_906.jpg?resize=400px:*","https://www.theverge.com/2017/12/5/16736260/google-android-oreo-go-edition?utm_source=inshorts&utm_medium=referral&utm_campaign=fullarticle ","pvqj5uu2-2"
"570","technology","China open to Western companies, says Alibaba's Jack Ma","Chinese e-commerce giant Alibaba's CEO Jack Ma at a recent event said that China is open to Western companies, provided they follow the country's rules. He also said that he told Amazon Founder Jeff Bezos to send entrepreneurs to China, rather than professional managers. The event was also attended by Apple CEO Tim Cook and Google CEO Sundar Pichai. ","http://images.newsinshorts.com.edgesuite.net/app_assets/images/2017/5dec/inshorts_image_1512459218474_580.jpg?resize=400px:*","https://www.bloomberg.com/news/articles/2017-12-05/jack-ma-says-china-open-to-western-companies-that-follow-rules?utm_source=inshorts&utm_medium=referral&utm_campaign=fullarticle ","pvqj5uu2-2"
"571","technology","Will face gut-wrenching decade in autonomous cars: Lyft CSO","While talking about autonomous cars, Lyft's Chief Strategy Officer Raj Kapoor has said, ""We're going to go through a gut-wrenching decade"" before any firm takes the lead. He also said that Lyft has a chance to disrupt Google Maps as the leader in routing technology using the driving data collected by its drivers. ","http://images.newsinshorts.com.edgesuite.net/app_assets/images/2017/5dec/inshorts_image_1512479626826_622.jpg?resize=400px:*","https://www.youtube.com/watch?v=mUfMJu8LGcA&utm_source=inshorts&utm_medium=referral&utm_campaign=fullarticle ","pvqj5uu2-2"
"572","technology","Apple wins trademark case over Xiaomi's 'Mi Pad'","Apple has won a trademark case against Chinese smartphone maker Xiaomi for registering 'Mi Pad' tablet computer as an EU trademark. Apple opposed the application filed by Xiaomi in 2014 claiming that the name was similar to 'iPad'. The presence of an additional letter 'm' at the beginning of 'Mi Pad' isn't sufficient to offset the similarity, the court said.","http://images.newsinshorts.com.edgesuite.net/app_assets/images/2017/5dec/inshorts_image_1512479628913_926.jpg?resize=400px:*","http://www.livemint.com/Technology/Zj7n7PXT7Hm8Emsu3gNieN/Apple-wins-EU-trademark-case-against-Xiaomi.html?utm_source=inshorts&utm_medium=referral&utm_campaign=fullarticle ","pvqj5uu2-2"
"573","technology","App lets users motivate runners with voice messages","Finland-based marathon runners have developed an app called 'Cheer Friend' which allows users to motivate runners by sending personal voice messages. Users can share a link with their support group who are not required to download the app. The link allows the user's friends and family to record short voice messages to be delivered to them during the race.","http://images.newsinshorts.com.edgesuite.net/app_assets/images/2017/4dec/inshorts_image_1512370129602_202.jpg?resize=400px:*","https://techcrunch.com/2017/12/03/cheer-my-friend-lets-you-motivate-runners-with-voice-messages/?utm_source=inshorts&utm_medium=referral&utm_campaign=fullarticle ","pvqj5uu2-2"
"574","technology","Facebook top tech company to work for in US in 2018","Social media giant Facebook has topped the list of best tech companies to work for in 2018 in the US, according to Glassdoor. Technology giant Google was ranked number 5 on the list, while Microsoft was ranked 39. Facebook also topped the list of the average span of employee retention with 2.02 years, according to career advisory firm Paysa. ","http://images.newsinshorts.com.edgesuite.net/app_assets/images/2017/6dec/inshorts_image_1512552518317_369.jpg?resize=400px:*","https://techcrunch.com/gallery/these-are-the-10-best-tech-companies-to-work-for-in-the-u-s-according-to-glassdoor/slide/10/?utm_source=inshorts&utm_medium=referral&utm_campaign=fullarticle ","pvqj5uu2-2"
