"ind","catg","headline","body","imageurl","readmoreurl","inblockId"
"1","technology","Tencent leads $5.4 billion investment in Wanda Commercial","China's Tencent has led a $5.4-billion investment in the country's largest commercial property company Wanda Commercial. Tencent along with Suning Holdings, Sunac China Holdings, and JD.com, will acquire 14% stake in the company. Following the deal, Wanda Commercial will utilise the online resources owned by Tencent and other investors.","http://images.newsinshorts.com.edgesuite.net/app_assets/images/2018/30jan/inshorts_image_1517297876705_572.jpg?resize=400px:*","https://www.bloomberg.com/news/articles/2018-01-29/tencent-leads-5-4-billion-investment-in-wanda-commercial?utm_source=inshorts&utm_medium=referral&utm_campaign=fullarticle ","vtefyuzj-2"
"2","technology","Tweet inciting violence not in violation of rules: Twitter","Responding to a tweet calling to incite violence, Twitter said, ""we have investigated the reported content and could not identify any violations of the Twitter rules or applicable laws."" The tweet was by journalist Jagrati Shukla's verified account, which has 36,500 followers. Notably, Twitter has been criticised in the past for not doing enough to curb abuse on its platform.","http://images.newsinshorts.com.edgesuite.net/app_assets/images/2018/30jan/inshorts_image_1517295104717_313.jpg?resize=400px:*","https://www.indiatoday.in/technology/news/story/tweet-calling-for-killing-of-muslims-in-india-doesn-t-violate-rules-says-twitter-1156743-2018-01-29?utm_source=inshorts&utm_medium=referral&utm_campaign=fullarticle ","vtefyuzj-2"
"3","technology","Apple's value falls $46 bn in a week on low iPhone X demand","Technology giant Apple's stock has plunged 5.1% since January 22 over reports of low iPhone X demand, wiping out $46.4 billion from its market capitalisation. Nikkei on Monday reported that Apple would halve its iPhone X production for the first quarter, from over 40 million units to 20 million. It added this was due to weaker-than-expected demand for iPhone X.","http://images.newsinshorts.com.edgesuite.net/app_assets/images/2018/30jan/inshorts_image_1517322170272_189.jpg?resize=400px:*","https://uk.reuters.com/article/uk-apple-iphonex/apple-shares-skid-on-report-of-iphone-x-production-cut-idUKKBN1FI17V?utm_source=inshorts&utm_medium=referral&utm_campaign=fullarticle ","vtefyuzj-2"
"4","technology","US probing Apple updates that slowed older iPhones: Report","The US Department of Justice and the Securities and Exchange Commission are reportedly investigating if Apple violated securities laws while issuing an update that slowed older iPhone models. Reports suggested investigators are looking into public statements made by Apple on the situation. Earlier, Apple admitted to slowing older iPhones with low capacity batteries to avoid unexpected shutdowns. ","http://images.newsinshorts.com.edgesuite.net/app_assets/images/2018/31jan/inshorts_image_1517370402038_937.jpg?resize=400px:*","https://www.bloomberg.com/news/articles/2018-01-30/u-s-said-to-probe-apple-over-updates-that-slow-older-iphones-jd1yahj7?utm_source=inshorts&utm_medium=referral&utm_campaign=fullarticle ","vtefyuzj-2"
"5","technology","Nuclear waste from Chernobyl used to develop crypto security","Developers of cryptocurrency Zcash have used radioactive waste from Chernobyl nuclear plant in Ukraine to build a secure cryptocurrency system. They used radioactive graphite from the site to create low-level gamma and beta radiation for generating random numbers to be used in cryptography. The developers performed the procedure on a private aircraft at a 3,000-foot altitude to ensure security.","http://images.newsinshorts.com.edgesuite.net/app_assets/images/2018/31jan/inshorts_image_1517379374636_666.jpg?resize=400px:*","https://www.rt.com/business/417364-zcash-chernobyl-secrecy/?utm_source=inshorts&utm_medium=referral&utm_campaign=fullarticle ","vtefyuzj-2"
"6","technology","Facebook bans ads promoting cryptocurrencies","Facebook has prohibited advertisements that promote financial services that are associated with misleading or deceptive promotional practices, naming cryptocurrencies and initial coin offerings among those. While Facebook said it wants people to learn about these services through its ads, it added that many companies advertising such services ""are not currently operating in good faith.""","http://images.newsinshorts.com.edgesuite.net/app_assets/images/2018/31jan/inshorts_image_1517369314631_415.jpg?resize=400px:*","https://techcrunch.com/2018/01/30/facebook-is-banning-cryptocurrency-and-ico-ads/?utm_source=inshorts&utm_medium=referral&utm_campaign=fullarticle ","vtefyuzj-2"
"7","technology","WhatsApp now allows users to send texts using Siri on iPhone","Messaging service WhatsApp's recent update allows users to send messages on iPhone using Apple's digital assistant Siri. The service has been integrated into Apple's co-pilot called CarPlay which lets Siri notify users of WhatsApp messages, and offers to read them aloud one by one. Siri will also confirm the message with users before sending or editing the content.","http://images.newsinshorts.com.edgesuite.net/app_assets/images/2018/30jan/inshorts_image_1517324475760_579.jpg?resize=400px:*","https://www.theverge.com/2018/1/29/16944568/whatsapp-apple-carplay-support-update-siri-messaging-car?utm_source=inshorts&utm_medium=referral&utm_campaign=fullarticle ","vtefyuzj-2"
"8","technology","Apple to cut iPhone X production target by half: Report","Apple has notified its suppliers that it's cutting production target for the iPhone X in the three-month period from January by half, according to reports. The target has reportedly been cut to around 20 million units due to slower-than-expected sales in the holiday shopping season. Earlier, reports said Apple may stop iPhone X production by mid-2018 due to disappointing sales.","http://images.newsinshorts.com.edgesuite.net/app_assets/images/2018/30jan/inshorts_image_1517318469963_342.jpg?resize=400px:*","https://www.hindustantimes.com/tech/apple-to-cut-iphone-x-production-target-by-half-report/story-QEOsW6GLiaNMT2mtkMW0hM.html?utm_source=inshorts&utm_medium=referral&utm_campaign=fullarticle ","vtefyuzj-2"
"9","technology","Amazon opens rainforest-like office in US","E-commerce giant Amazon has opened a rainforest-like office called 'The Spheres' in Seattle, US. The structure is reportedly made of three connected spheres constructed from glass and steel, and can accommodate up to 800 people. The Spheres feature walls which are vertical gardens with over 25,000 plants woven into 4,000 square feet of mesh.","http://images.newsinshorts.com.edgesuite.net/app_assets/images/2018/1jan/30/qenc0quf-2-1517311818158.jpg?resize=400px:*","https://www.reuters.com/article/us-amazon-com-spheres/amazon-com-opens-its-own-rainforest-in-seattle-idUSKBN1FI1D7?utm_source=inshorts&utm_medium=referral&utm_campaign=fullarticle ","vtefyuzj-2"
"10","technology","Ex-Google engineers make self-driving car for goods delivery","Former engineers at Google's self-driving car project Waymo, Dave Ferguson and Jiajun Zhu, have developed a self-driving vehicle to transport local goods. The electric vehicle can read traffic signals, identify pedestrians, and can handle errands such as dry cleaning. It was unveiled on Tuesday by Ferguson and Zhu's startup Nuro, which was founded in 2016.","http://images.newsinshorts.com.edgesuite.net/app_assets/images/2018/31jan/inshorts_image_1517375866911_195.jpg?resize=400px:*","https://www.theverge.com/2018/1/30/16936548/nuro-self-driving-delivery-last-mile-google?utm_source=inshorts&utm_medium=referral&utm_campaign=fullarticle ","vtefyuzj-2"
"11","technology","Tinder discriminates against users over 30, US court rules","A US appeals court has ruled that dating app Tinder is discriminating against users above 30 by charging them $19.99 per month for its premium service, Tinder Plus. In comparison, users below 30 years of age are being charged $9.99 per month. This came after Allan Candelore sued Tinder over the pricing on behalf of himself and other California consumers.","http://images.newsinshorts.com.edgesuite.net/app_assets/images/2018/31jan/inshorts_image_1517383944675_996.jpg?resize=400px:*","https://techcrunch.com/2018/01/30/appeals-court-rules-that-tinders-pricing-violates-age-discrimination-laws/?utm_source=inshorts&utm_medium=referral&utm_campaign=fullarticle ","vtefyuzj-2"
"12","technology","Don't believe anything Musk or Tesla says: Apple Co-founder","Technology giant Apple's Co-founder Steve Wozniak has said, ""Now I don't believe anything Elon Musk or Tesla says, but I still love the car."" Wozniak's comment came in reference to the delays in the implementation of technology that Musk claimed Tesla would bring to its cars. Wozniak further said that Musk is ""just a good salesman"", like Steve Jobs.","http://images.newsinshorts.com.edgesuite.net/app_assets/images/2018/31jan/inshorts_image_1517392540398_665.jpg?resize=400px:*","http://fortune.com/2018/01/30/steve-wozniak-elon-musk-tesla/?utm_source=inshorts&utm_medium=referral&utm_campaign=fullarticle ","vtefyuzj-2"
"13","technology","Startup lets users render themselves inside VR in real time","Switzerland-based virtual reality (VR) startup Imverse has developed a technology which lets users render themselves inside VR in real time. It is able to deliver the sensation of a user's real body existing in virtual reality. It also offers the ability to render other objects, including people, allowing a user in a VR headset shake hands with one who isn't.","http://images.newsinshorts.com.edgesuite.net/app_assets/images/2018/31jan/inshorts_image_1517376037012_942.jpg?resize=400px:*","https://techcrunch.com/2018/01/30/imverse-mixed-reality/?utm_source=inshorts&utm_medium=referral&utm_campaign=fullarticle ","vtefyuzj-2"
"14","technology","Google completes $1.1-billion deal to buy engineers from HTC","Google has completed the $1.1-billion deal with electronics company HTC, under which Google acquired part of HTC's engineering and design teams. The deal also includes employees that have worked on Google's Pixel smartphones. It was announced in September last year and also included a non-exclusive license for HTC intellectual property.","http://images.newsinshorts.com.edgesuite.net/app_assets/images/2018/30jan/inshorts_image_1517303307756_417.jpg?resize=400px:*","https://www.engadget.com/2018/01/30/google-htc-pixel-1-1-billion/?utm_source=inshorts&utm_medium=referral&utm_campaign=fullarticle ","vtefyuzj-2"
"15","technology","Google adds Hindi language support for its digital assistant","Technology giant Google has added Hindi language support for its digital assistant for users on Allo messenger in India. The feature can be enabled by setting ""English (India)"" as the primary language on Android phones. Google Assistant then translates the Hindi voice commands to English and displays the answer in Hindi on the screen. ","http://images.newsinshorts.com.edgesuite.net/app_assets/images/2018/31jan/inshorts_image_1517387932368_996.jpg?resize=400px:*","http://www.bgr.in/news/google-assistant-now-communicates-in-hindi/?utm_source=inshorts&utm_medium=referral&utm_campaign=fullarticle ","vtefyuzj-2"
"16","technology","Amazon's global losses hit $2 billion in Jan-Sep 2017","E-commerce giant Amazon's global losses have surged to $2.1 billion for the period between January-September 2017. Amazon reportedly also incurred $800 million loss in its international businesses for the same period. In a recent presentation made to the company shareholders, Amazon disclosed that majority of its international losses are on account of its investment in the Indian subsidiaries.","http://images.newsinshorts.com.edgesuite.net/app_assets/images/2018/30jan/inshorts_image_1517295531117_694.jpg?resize=400px:*","https://inc42.com/buzz/indian-amazon-international-losses/?utm_source=inshorts&utm_medium=referral&utm_campaign=fullarticle ","vtefyuzj-2"
"17","technology","Amazon Alexa can now play PM Modi's Mann Ki Baat","The segments of PM Narendra Modi's monthly radio address 'Mann Ki Baat' are now supported on Amazon voice assistant software Alexa Skill. Users can listen to all previous episodes that have been aired since January 2015. The latest segments of the show can be accessed on the Alexa devices within a few hours of the broadcast.","http://images.newsinshorts.com.edgesuite.net/app_assets/images/2018/30jan/inshorts_image_1517305849021_820.jpg?resize=400px:*","http://www.ibtimes.co.in/missed-pm-modis-maan-ki-baat-dont-worry-alexas-got-your-back-758610?utm_source=inshorts&utm_medium=referral&utm_campaign=fullarticle ","vtefyuzj-2"
"18","technology","7L apps removed from Google Play in 2017, up 70% from 2016","Technology giant Google has said it took down seven lakh apps from its Play Store that violated its policies, marking a 70% increase in the total removals from 2016. Google added that 99% of apps with abusive content were identified and rejected before the users could install them. The improvements were made through using new machine learning models, Google highlighted.","http://images.newsinshorts.com.edgesuite.net/app_assets/images/2018/31jan/inshorts_image_1517391684155_615.jpg?resize=400px:*","https://techcrunch.com/2018/01/30/google-says-it-removed-700k-apps-from-the-play-store-in-2017-up-70-from-2016/?utm_source=inshorts&utm_medium=referral&utm_campaign=fullarticle ","vtefyuzj-2"
"19","technology","Facebook hires Google's AR Product Director Nikhil Chandhok","Facebook has hired technology giant Google's Director of Product for augmented reality (AR) Nikhil Chandhok. Chandhok, who is an alumnus of the University of Pune, has joined the social media major as its Director of Product for AR and Camera. Chandhok has previously served YouTube and Microsoft as General Manager and Program Manager respectively.","http://images.newsinshorts.com.edgesuite.net/app_assets/images/2018/30jan/inshorts_image_1517310338495_100.jpg?resize=400px:*","https://techcrunch.com/2018/01/29/facebook-nabs-googles-ar-product-director/?utm_source=inshorts&utm_medium=referral&utm_campaign=fullarticle ","vtefyuzj-2"
"20","technology","Alibaba launches AI-based traffic solution in Malaysia","Alibaba's cloud computing unit has launched artificial intelligence (AI) based solution 'Malaysia City Brain' to manage traffic at Kuala Lumpur, Malaysia. It will be implemented in collaboration with Malaysia Digital Economy Corporation and city council Dewan Bandaraya Kuala Lumpur. Earlier, Alibaba deployed the same system in Hangzhou, China, which detected traffic violations with 92% accuracy.","http://images.newsinshorts.com.edgesuite.net/app_assets/images/2018/30jan/inshorts_image_1517305883334_332.jpg?resize=400px:*","https://www.vccircle.com/alibaba-cloud-launches-ai-based-solution-to-manage-kuala-lumpur-city-traffic/?utm_source=inshorts&utm_medium=referral&utm_campaign=fullarticle ","vtefyuzj-2"
"21","technology","Global device shipments to hit 2.3 bn units in 2018: Gartner","Worldwide shipments of devices including computers, tablets, and mobile phones will reach 2.32 billion units in 2018, an increase of 2.1% from last year, according to a report by Gartner. The shipments totalled 2.28 billion units in 2017. Further, 9% of the smartphones sold will support 5G by the year 2021, Gartner added.","http://images.newsinshorts.com.edgesuite.net/app_assets/images/2018/30jan/inshorts_image_1517296230483_570.jpg?resize=400px:*","https://www.hindustantimes.com/tech/global-device-shipments-to-hit-2-32-billion-units-in-2018-gartner/story-vQlgupRgajVVQMyyGtNmzN.html?utm_source=inshorts&utm_medium=referral&utm_campaign=fullarticle ","vtefyuzj-2"
"22","technology","3D-printing ink may allow changing colours of objects daily","MIT researchers have developed an ink that changes the colour of 3D-printed plastic objects when exposed to ultraviolet light for 20 minutes. Researchers said people are consuming a lot more now compared to 20 years ago and generating a lot of waste. ""By changing an object's colour, you don't have to create a whole new object every time,"" they added.","http://images.newsinshorts.com.edgesuite.net/app_assets/images/2018/30jan/inshorts_image_1517311099642_205.jpg?resize=400px:*","https://www.vccircle.com/new-3d-printing-technique-may-be-able-to-change-the-colour-of-objects-every-day/?utm_source=inshorts&utm_medium=referral&utm_campaign=fullarticle ","vtefyuzj-2"
"23","technology","Facebook sued by family of man whose murder was streamed","Facebook has been sued in the US for negligence and wrongful death by the family of the man whose murder was streamed on the platform. The man's family has alleged that before committing murder, the murderer posted a video announcing his intent to kill and Facebook should have alerted the police immediately. The victim was killed in April last year.","http://images.newsinshorts.com.edgesuite.net/app_assets/images/2018/31jan/inshorts_image_1517381033745_818.jpg?resize=400px:*","https://www.theverge.com/2018/1/30/16950804/facebook-robert-godwin-family-wrongful-death-lawsuit?utm_source=inshorts&utm_medium=referral&utm_campaign=fullarticle ","vtefyuzj-2"
"24","technology","Job loss fears in IT industry highly exaggerated: TCS COO","Talking about automation at a recent event, Tata Consultancy Services' COO N Ganapathy Subramaniam said the job loss fears in the IT industry are highly exaggerated. He also said that the industry changes every 3-5 years and constantly requires 'upskilling'. Studies have shown automation results in people getting reoriented and improving quality of work, he added.","http://images.newsinshorts.com.edgesuite.net/app_assets/images/2018/31jan/inshorts_image_1517393535476_797.jpg?resize=400px:*","http://www.livemint.com/Companies/i5V2M0q7xD4kkybYmpeLAL/Automation-is-about-upscaling-business-not-job-cuts-TCS-CO.html?utm_source=inshorts&utm_medium=referral&utm_campaign=fullarticle ","vtefyuzj-2"
"25","technology","Hackers steal ₹95 lakh worth Ethereum by faking crypto sale","Hackers have stolen over ₹95 lakh worth Ethereum by tricking people to participate in a fake cryptocurrency token sale. The hackers targeted Initial Coin Offering (ICO) of Experty and promoted a fake token sale in its name to potential investors. The users were sent emails asking them to make payments to a fraudulent Ethereum wallet address.","http://images.newsinshorts.com.edgesuite.net/app_assets/images/2018/30jan/inshorts_image_1517327224266_221.jpg?resize=400px:*","http://www.bgr.in/news/hacker-steals-150000-by-faking-cryptocurrency-pre-sale/?utm_source=inshorts&utm_medium=referral&utm_campaign=fullarticle ","vtefyuzj-2"
"26","technology","Vodafone helps child prodigy to play against Carolina Marin","Vodafone India provided a platform to 14-year-old Vamsi Krishna, gold medallist in national doubles under-13, to play against Olympic Champion Carolina Marin at the Premier Badminton League. Son of a bus driver and a local badminton coach, the child prodigy was discovered by Coach Goverdhan Reddy who started a crowdfunding campaign to raise money for his formal training.","http://images.newsinshorts.com.edgesuite.net/app_assets/images/2018/28jan/inshorts_image_1517122783968_849.jpg?resize=400px:*","https://www.youtube.com/watch?v=aAzDrQuzI9M&feature=youtu.be ","ahbpyhqh-1"
"27","technology","Fitness tracker reveals location of secret military bases","Fitness-tracking app Strava is reportedly revealing sensitive information about secret military bases through the heat map publicly available on its website. The website, which uses satellites to map users' areas of activity, also shows soldiers and agents' routes in sensitive locations, recently pointed out by military analysts. An analyst said, ""US Bases are clearly identifiable and mappable"".","http://images.newsinshorts.com.edgesuite.net/app_assets/images/2018/1jan/29/xdtbaj1l-2-1517221350410.jpg?resize=400px:*","https://www.theguardian.com/world/2018/jan/28/fitness-tracking-app-gives-away-location-of-secret-us-army-bases?utm_source=inshorts&utm_medium=referral&utm_campaign=fullarticle ","ahbpyhqh-1"
"28","technology","Celebs, politicians buy fake social media followers: Report","According to a report by The New York Times, actors, politicians, and television presenters were among those who bought millions of fake social media followers. The report said the accounts were bought from a company called Devumi which claims to increase a user's ""social media presence"". In a statement, Twitter said it is working to stop Devumi and similar companies.","http://images.newsinshorts.com.edgesuite.net/app_assets/images/2018/28jan/inshorts_image_1517136674483_666.jpg?resize=400px:*","https://mashable.com/2018/01/27/celebrities-buy-fake-followers-twitter-responds-spam/?utm_source=inshorts&utm_medium=referral&utm_campaign=fullarticle#eG0XJ5WLrPqM ","ahbpyhqh-1"
"29","technology","US prosecutor to investigate firm selling online followers","The New York attorney general, Eric Schneiderman, will investigate Devumi, a company that allegedly sold millions of fake social media followers. This follows a report by The New York Times, which said at least 55,000 of Devumi's accounts used personal details of real Twitter users. It said famous actors, television presenters and entrepreneurs were among those who bought Devumi followers. ","http://images.newsinshorts.com.edgesuite.net/app_assets/images/2018/28jan/inshorts_image_1517145246973_930.jpg?resize=400px:*","https://www.reuters.com/article/us-new-york-followers/new-york-prosecutor-to-investigate-firm-selling-online-followers-idUSKBN1FG0YI?utm_source=inshorts&utm_medium=referral&utm_campaign=fullarticle ","ahbpyhqh-1"
"30","technology","Users complain Google Home doesn't answer to 'Who is Jesus?'","Google Home users have reportedly complained that the company's smart speaker was unable to answer questions like, 'Who is Jesus?', but could respond to queries about Buddha, Muhammad, and Satan. ""This wasn't out of disrespect but to ensure respect. It might not reply in cases where web content is more vulnerable to vandalism & spam,"" responded Google in a statement.","http://images.newsinshorts.com.edgesuite.net/app_assets/images/2018/28jan/inshorts_image_1517151267402_961.jpg?resize=400px:*","http://fortune.com/2018/01/27/google-home-jesus/?utm_source=inshorts&utm_medium=referral&utm_campaign=fullarticle ","ahbpyhqh-1"
"31","technology","1 in 5 jobs in Britain may be displaced by 2030: Report","One in five existing jobs in Great Britain, amounting to 3.6 million, may be displaced by 2030 due to the rise of robots, according to Centre for Cities' report. It suggested retail, customer service roles, and warehouse jobs were among the most at risk. Around 18% jobs were at risk in southern cities, compared to 23% elsewhere in the country.","http://images.newsinshorts.com.edgesuite.net/app_assets/images/2018/29jan/inshorts_image_1517222899803_339.jpg?resize=400px:*","http://www.centreforcities.org/publication/cities-outlook-2018/?utm_source=inshorts&utm_medium=referral&utm_campaign=fullarticle ","ahbpyhqh-1"
"32","technology","Intel told Chinese firms about chip flaw before US: Report","Intel warned some customers, including several Chinese technology firms, about security flaws within its processor chips before informing the US government, the Wall Street Journal has reported. China's Alibaba was reportedly among the firms notified of the flaw early on. An Intel spokesperson said the company wasn't able to tell everyone because the news was made public earlier than expected.","http://images.newsinshorts.com.edgesuite.net/app_assets/images/2018/29jan/inshorts_image_1517196229150_726.jpg?resize=400px:*","https://techcrunch.com/2018/01/28/intel-reportedly-notified-chinese-companies-of-chip-security-flaw-before-the-u-s-government/?utm_source=inshorts&utm_medium=referral&utm_campaign=fullarticle ","ahbpyhqh-1"
"33","technology","IT ministry tests LED-based wireless communication tech","IT ministry has tested LiFi, an LED-based wireless communication technology, jointly conducted with IIT-Madras and lighting company Philips India. LiFi, or light fidelity, aims to replace WiFi by using light to transmit internet signals with speeds up to 10 Gbps. The technology was reportedly being tested to cover areas that cannot be reached by the existing network.","http://images.newsinshorts.com.edgesuite.net/app_assets/images/2018/29jan/inshorts_image_1517229986149_842.jpg?resize=400px:*","https://www.vccircle.com/will-lifi-replace-wifi-it-ministry-finds-out-if-light-can-power-the-internet/?utm_source=inshorts&utm_medium=referral&utm_campaign=fullarticle ","ahbpyhqh-1"
"34","technology","Lenovo flaw allows hackers to bypass fingerprint scanners","China-based laptop maker Lenovo has identified a flaw in the Fingerprint Manager Pro software which allows hackers to bypass fingerprint scanners to gain access to user devices. The flaw also exposes users' login credentials and fingerprint data, according to the company. Patches have been released for the bug in the software which uses fingerprint recognition for log into the PCs.","http://images.newsinshorts.com.edgesuite.net/app_assets/images/2018/30jan/inshorts_image_1517291313360_823.jpg?resize=400px:*","https://www.engadget.com/2018/01/29/lenovo-fingerprint-manager-passwords-vulnerable/?utm_source=inshorts&utm_medium=referral&utm_campaign=fullarticle ","ahbpyhqh-1"
