"ind","catg","headline","body","imageurl","readmoreurl","inblockId"
"779","technology"," I have feelings like everyone: World's 1st robot citizen","The world's first robot to receive a citizenship, Sophia, during a recent interview said that she has feelings like everyone else. Sophia also said that she does not like the way robots are portrayed in the films. The humanoid added that it might be helpful to think of her as a ""new animal species"".","http://images.newsinshorts.com.edgesuite.net/app_assets/images/2017/9nov/inshorts_image_1510224968389_523.jpg?resize=400px:*","http://uk.reuters.com/video/2017/11/08/sophia-the-robot-says-i-have-feelings-to?videoId=372929708&videoChannel=4http://uk.reuters.com/video/2017/11/08/sophia-the-robot-says-i-have-feelings-to?videoId=372929708&videoChannel=4000&utm_source=inshorts&utm_medium=referral&utm_campaign=fullarticle ","5atfmkio-1"
"780","technology","Users report iPhone X becomes unresponsive in cold weather","Some Apple iPhone X users have reported that their phone's display does not respond to touch in cold weather. Users highlighted that while the touch was inconsistent in the cold, it started functioning normally once they entered a warmer environment. Earlier, users had reported activation issues in their iPhone X smartphones.","http://images.newsinshorts.com.edgesuite.net/app_assets/images/2017/9nov/inshorts_image_1510207502182_489.jpg?resize=400px:*","http://www.bgr.in/news/apple-iphone-x-display-reportedly-becomes-unresponsive-in-cold-weather/?utm_source=inshorts&utm_medium=referral&utm_campaign=fullarticle ","5atfmkio-1"
"781","technology","Intel CEO explains why he left Trump’s Manufacturing Council","Intel CEO Brian Krzanich left Trump's Manufacturing Council in August in light of violence in Virginia. Krzanich said, Merck CEO Kenneth Frazier's decision to quit from the council triggered him to leave as things became politicised after Trump criticised Frazier's decision. Frazier's decision came after Trump said that both the alt-right and left-wing supporters were responsible for the violence.","http://images.newsinshorts.com.edgesuite.net/app_assets/images/2017/10nov/inshorts_image_1510293599048_427.jpg?resize=400px:*","http://fortune.com/2017/11/09/donald-trump-twitter-brian-krzanich/?utm_source=inshorts&utm_medium=referral&utm_campaign=fullarticle ","5atfmkio-1"
"782","technology","Facebook explains how it will fight 'revenge porn'","After asking users to share their private pictures with it to prevent 'revenge porn', Facebook clarified it is not going to store the images. Users can send their picture to themselves on Messenger to create an unreadable numerical fingerprint of the image, Facebook added. If someone tries to upload those pictures, Facebook will detect the fingerprint and block such uploads.","http://images.newsinshorts.com.edgesuite.net/app_assets/images/2017/10nov/inshorts_image_1510299689689_440.jpg?resize=400px:*","https://www.theverge.com/2017/11/9/16630900/facebook-revenge-porn-defense-details?utm_source=inshorts&utm_medium=referral&utm_campaign=fullarticle ","5atfmkio-1"
"783","technology","Pokémon Go maker announces Harry Potter AR game","Maker of the augmented reality (AR) game Pokémon Go, Niantic, has announced it is making a Harry Potter-based AR game. The 'Harry Potter: Wizards Unite' game will allow players to learn spells, fight legendary beasts, and team up with others to beat enemies, Niantic said. It has partnered with Warner Bros. Interactive and WB Games for the game.","http://images.newsinshorts.com.edgesuite.net/app_assets/images/2017/10nov/inshorts_image_1510311298745_710.jpg?resize=400px:*","https://www.theverge.com/2017/11/8/16623784/niantic-labs-pokemon-go-harry-potter-ar?utm_source=inshorts&utm_medium=referral&utm_campaign=fullarticle ","5atfmkio-1"
"784","technology","Just Dial shares surge 20% on reports of takeover by Google","Online local search engine Just Dial's shares surged nearly 20% during intraday trade on Friday. This comes after a media report said Google is in talks with the company to acquire its business. However, Just Dial denied the report saying, ""there is no proposal in respect of acquisition of business of Just Dial by Google and news published...is factually incorrect.""","http://images.newsinshorts.com.edgesuite.net/app_assets/images/2017/10nov/inshorts_image_1510302091012_413.jpg?resize=400px:*","http://www.india.com/business/just-dial-shares-jump-to-a-six-month-high-following-google-acquisition-buzz-2619744/?utm_source=inshorts&utm_medium=referral&utm_campaign=fullarticle ","5atfmkio-1"
"785","technology","Former Yahoo CEO Marissa Mayer apologises for data breaches","Former Yahoo CEO Marissa Mayer has apologised for the data breaches faced by the internet company during her tenure. Mayer added that Yahoo has not been able to identify the intrusion leading to the 2013 breach. Last month, Yahoo revealed that all of its three billion users' accounts were hacked in the world's biggest data breach which occurred in 2013.","http://images.newsinshorts.com.edgesuite.net/app_assets/images/2017/9nov/inshorts_image_1510212605775_379.jpg?resize=400px:*","http://in.reuters.com/article/usa-databreaches/former-yahoo-ceo-apologizes-for-data-breaches-blames-russians-idINKBN1D827P?utm_source=inshorts&utm_medium=referral&utm_campaign=fullarticle ","5atfmkio-1"
"786","technology","Scientists print washable, stretchy electronics onto fabric","A Cambridge University-led research has successfully incorporated washable, stretchable and breathable electronic circuits into fabric. The textile electronic devices are based on low-cost, sustainable printing of inks based on graphene, a 2D form of carbon. The fabrics developed are comfortable to wear and can survive up to 20 cycles in a typical washing machine, said researchers.","http://images.newsinshorts.com.edgesuite.net/app_assets/images/2017/9nov/inshorts_image_1510218061332_857.jpg?resize=400px:*","https://phys.org/news/2017-11-fully-circuits-fabric.html?utm_source=inshorts&utm_medium=referral&utm_campaign=fullarticle ","5atfmkio-1"
"787","technology","Apple confirms iPhone X becomes unresponsive in cold weather","Apple has confirmed that it is aware of the instances where iPhone X's screen will become temporarily unresponsive to touch after a rapid change to a cold environment. The issue will be addressed in an upcoming software update, Apple added. This comes after users reported that the touch was inconsistent in the cold but functioned normally in warmer environment.","http://images.newsinshorts.com.edgesuite.net/app_assets/images/2017/10nov/inshorts_image_1510294306392_930.jpg?resize=400px:*","https://www.theverge.com/2017/11/9/16631596/apple-iphone-x-cold-weather-screen-bug-software-update?utm_source=inshorts&utm_medium=referral&utm_campaign=fullarticle ","5atfmkio-1"
"788","technology","Video shows fight between robots from Russia, Britain","A video shows a fight between robots from Russia and Britain armed with axes, hammers and other weapons. The competition which took place between several Russian and British teams was judged by a robot. The competition, won by Russian teams 'St.Pete's Energy' and 'Solarbot and Weber', was organised by Robocorp group in the Russian city of St. Petersburg.","http://images.newsinshorts.com.edgesuite.net/app_assets/images/2017/8nov/inshorts_image_1510143950950_529.jpg?resize=400px:*","https://www.youtube.com/watch?v=9LhyZPvhTjY&utm_source=inshorts&utm_medium=referral&utm_campaign=fullarticle ","5atfmkio-1"
"789","technology","Bengaluru most conducive for digital transformation: Report","Bengaluru has topped the list of global cities with the most conducive environment for digital transformation, beating cities like London, San Francisco, and Beijing, a report by Economist Intelligence Unit has said. The report, which was released on Tuesday, found that despite infrastructure deficit, pollution, and poverty, Indian cities were ranked highly in terms of digital transformation.","http://images.newsinshorts.com.edgesuite.net/app_assets/images/2017/9nov/inshorts_image_1510215727896_565.jpg?resize=400px:*","http://www.newindianexpress.com/cities/bengaluru/2017/nov/09/namma-bengaluru-leads-the-way-in-digital-transformation-1696136.html?utm_source=inshorts&utm_medium=referral&utm_campaign=fullarticle ","5atfmkio-1"
"790","technology","Google Pixel 2 XL users report of screen flashing issue","Users have reported a screen flashing issue in Google's Pixel 2 XL in which the screen flashes briefly when the device is locked or unlocked. Users also claimed that restarting or even resetting the phone did not fix the issue. Earlier, users also reported of Pixel 2 XL's screen burn-in issue in which the screen turned partially grey. ","http://images.newsinshorts.com.edgesuite.net/app_assets/images/2017/9nov/inshorts_image_1510207490469_614.jpg?resize=400px:*","http://www.bgr.in/news/google-pixel-2-xl-users-complain-about-flashing-screens/?utm_source=inshorts&utm_medium=referral&utm_campaign=fullarticle ","5atfmkio-1"
"791","technology","Nobody can ignore India: Huawei's Peter Zhai ","President of the Huawei India Consumer Business Group, Peter Zhai has said that nobody can ignore India because its market will keep becoming bigger. Adding that India is very important to Huawei, Zhai said, it wants to win the Indian market with its technology. He also added that in the next 3-5 years, India will be a very promising market.","http://images.newsinshorts.com.edgesuite.net/app_assets/images/2017/9nov/inshorts_image_1510229826080_734.jpg?resize=400px:*","http://www.thenewsminute.com/article/india-can-t-be-ignored-market-keep-getting-bigger-huawei-bets-big-cloud-ai-71349?utm_source=inshorts&utm_medium=referral&utm_campaign=fullarticle ","5atfmkio-1"
"792","technology","Woman develops 'Sorry' app for users to send apologies","Former cable news anchor Greta Van Susteren has developed an app called 'Sorry' to allow users to send apologies. The app will let users accept or reject an apology sent by other users which will be kept private between the two. However, apologies of public figures will be visible to all users, who can then accept or reject them.","http://images.newsinshorts.com.edgesuite.net/app_assets/images/2017/9nov/inshorts_image_1510216814005_992.jpg?resize=400px:*","https://techcrunch.com/2017/11/08/greta-van-susteren-is-releasing-an-apology-app-called-sorry/?utm_source=inshorts&utm_medium=referral&utm_campaign=fullarticle ","5atfmkio-1"
"793","technology","Tencent buys 12% stake in Snap","China's Tencent has acquired a 12% stake in Snapchat's parent company Snap, according to the company's latest quarterly filing. Snap said that Tencent acquired 145.8 million shares of its non-voting Class A common stock through open market purchases this month. Snap in its quarterly report also posted a net loss of $443.2 million.","http://images.newsinshorts.com.edgesuite.net/app_assets/images/2017/8nov/inshorts_image_1510146247698_133.jpg?resize=400px:*","https://techcrunch.com/2017/11/08/wechat-owner-tencent-snapped-up-another-12-of-snap-this-month/?utm_source=inshorts&utm_medium=referral&utm_campaign=fullarticle ","5atfmkio-1"
"794","technology","App lets users hide the 'notch' in Apple's iPhone X","US-based smartphone app maker Cromulent Labs has developed an app called 'Notcho' which lets users hide the 'notch' in Apple's iPhone X. Users can choose from some pre-loaded backgrounds within Notcho to conceal the notch or import photos and images for a notch-free wallpaper for the iPhone X. However, Notcho doesn't hide the notch while the apps are running.","http://images.newsinshorts.com.edgesuite.net/app_assets/images/2017/9nov/inshorts_image_1510223244256_285.jpg?resize=400px:*","http://www.ibtimes.co.in/finally-app-that-hides-iphone-x-notch-visual-treat-748667?utm_source=inshorts&utm_medium=referral&utm_campaign=fullarticle ","5atfmkio-1"
"795","technology","Alexa automatically plays loud music at night, cops called","A user in Germany has uploaded a Facebook post claiming that his Amazon Alexa smart speaker switched on automatically to play loud music at night while he was away. The neighbours had to call the police who broke into the apartment to unplug the speaker, the post read. However, Amazon has not made any comment on the incident yet. ","http://images.newsinshorts.com.edgesuite.net/app_assets/images/2017/9nov/inshorts_image_1510228231779_245.jpg?resize=400px:*","http://mashable.com/2017/11/08/amazon-alexa-rave-party-germany/?utm_source=inshorts&utm_medium=referral&utm_campaign=fullarticle#pU8DdAxOymqE ","5atfmkio-1"
"796","technology","Can always use more space: NASA on Twitter character update","Reacting to Twitter increasing the character limit for a tweet to 280 from 140 for the first time in 11 years, NASA tweeted ""Thanks @Twitter, we can always use more space #280characters,"" with a bunch of celestial emojis. ""But brevity is the soul of wit. #140characters,"" a user commented while another said, ""Pun level: OUT OF THIS WORLD"".","http://images.newsinshorts.com.edgesuite.net/app_assets/images/2017/9nov/inshorts_image_1510228154127_593.jpg?resize=400px:*","https://twitter.com/NASAGoddard/status/928356699043491842?utm_source=inshorts&utm_medium=referral&utm_campaign=fullarticle ","5atfmkio-1"
"797","technology","App to remind old people of medicine schedules developed","Mobile app called 'Dawai Dost' has been developed by 17-year-old Aryaman Kunzru that reminds old people of their medicine schedules. The app gives reminders through voice notifications and also gives audio tutorials. It allows users to either take a photo of the medicine or feed its name manually and set an alarm for when the medicines are to be consumed.","http://images.newsinshorts.com.edgesuite.net/app_assets/images/2017/10nov/inshorts_image_1510314706383_297.jpg?resize=400px:*","https://www.newsbytesapp.com/timeline/Science/12672/66031/including-senior-citizens-in-the-mobile-app-revolution?utm_source=inshorts&utm_medium=referral&utm_campaign=fullarticle ","5atfmkio-1"
"798","technology","Apple rolls out iOS 11.1.1 update to fix autocorrect issue","Technology giant Apple has rolled out iOS 11.1.1 software update to fix keyboard autocorrect issue. This comes after users reported that on typing the letter 'I', the iPhone's keyboard switched it to another letter followed by a symbol. The software update will also fix the bug that could stop 'Hey Siri' from functioning.","http://images.newsinshorts.com.edgesuite.net/app_assets/images/2017/10nov/inshorts_image_1510297661451_318.jpg?resize=400px:*","https://www.engadget.com/2017/11/09/apple-pushes-out-ios-11-1-1-to-fix-annoying-autocorrect-bug/?utm_source=inshorts&utm_medium=referral&utm_campaign=fullarticle ","5atfmkio-1"
"799","technology","Apple's ₹89,000 iPhone X costs ₹23,200 to make","Apple's most expensive phone iPhone X's base model, that is selling for ₹89,000 in India, costs the company ₹23,200 to make, according to technology intelligence firm TechInsights. iPhone X’s parts cost Apple 25% more than the iPhone 8, it added. Further, iPhone X makes the company more money per phone than the iPhone 8.","http://images.newsinshorts.com.edgesuite.net/app_assets/images/2017/7nov/inshorts_image_1510033781606_166.jpg?resize=400px:*","http://www.reuters.com/article/us-apple-iphone/apples-iphone-x-has-higher-margin-than-iphone-8-analysis-idUSKBN1D62RZ?il=0&utm_source=inshorts&utm_medium=referral&utm_campaign=fullarticle ","vfywpmxt-1"
"800","technology","Twitter increases character limit from 140 to 280","Twitter has increased the character limit from 140 to 280 for tweets in all languages where ""cramming was an issue"". Japanese, Chinese, and Korean languages will not receive the update as they can convey the same amount of information in lesser characters, Twitter said. This is the first time Twitter changed its character limit since it was launched in 2006.","http://images.newsinshorts.com.edgesuite.net/app_assets/images/2017/8nov/inshorts_image_1510123615514_945.jpg?resize=400px:*","https://www.engadget.com/2017/11/07/twitter-expands-280-character-tweet-access/?utm_source=inshorts&utm_medium=referral&utm_campaign=fullarticle ","vfywpmxt-1"
"801","technology","Mahatma Gandhi has inspired me: Microsoft CEO Satya Nadella","Technology giant Microsoft's India-born CEO Satya Nadella has said that Mahatma Gandhi inspires him, both as an Indian and as a global citizen. He added that Gandhi's life, his message and everything that he represented is ""so current"". On being asked to choose either Sachin Tendulkar or ML Jaisimha, Nadella said, he is a Hyderabadi and therefore will choose Jaisimha.","http://images.newsinshorts.com.edgesuite.net/app_assets/images/2017/7nov/inshorts_image_1510046746044_940.jpg?resize=400px:*","http://indiatoday.intoday.in/technology/story/india-today-conclave-next-2017-satya-nadella-says-future-is-all-about-mixed-reality-ai-and-quantum-computing/1/1083908.html?utm_source=inshorts&utm_medium=referral&utm_campaign=fullarticle ","vfywpmxt-1"
"802","technology","Broadcom proposes to acquire Qualcomm for $130 billion","Chipmaker Broadcom on Monday said it has offered to buy rival chipmaker Qualcomm in a cash and stock deal valued at $130 billion, including debt. Buying Qualcomm would make Broadcom the third-largest chipmaker, after Intel and Samsung Electronics. The deal if completed would be the biggest technology acquisition ever and will make Broadcom an over $200-billion company.","http://images.newsinshorts.com.edgesuite.net/app_assets/images/2017/6nov/inshorts_image_1509971268828_807.jpg?resize=400px:*","https://www.bloomberg.com/news/articles/2017-11-06/broadcom-offers-130-billion-for-qualcomm-in-landmark-tech-deal?utm_source=inshorts&utm_medium=referral&utm_campaign=fullarticle ","vfywpmxt-1"
"803","technology","Samsung loses out to Apple & OnePlus in Premium Phones","According to Counterpoint's Research data for Q3, 2017, Samsung's dominance in premium phone segment (priced above ₹30,000) is now challenged by OnePlus along with Apple. For the quarter ending Sept 2017, Apple had 35% market share, followed by OnePlus with 32% backed by the sales of OnePlus 5, which has become the top selling premium device within a quarter of its launch.","http://images.newsinshorts.com.edgesuite.net/app_assets/images/2017/4nov/inshorts_image_1509814868417_218.jpg?resize=400px:*","http://www.timesnownews.com/business-economy/article/samsung-pushed-to-no-3-slot-in-premium-phones-loses-to-apple-and-one-plus/116347?utm_source=inshorts&utm_medium=referral&utm_campaign=fullarticle&utm_source=inshorts&utm_medium=referral&utm_campaign=fullarticle ","vfywpmxt-1"
"804","technology","Google to display restaurant 'wait' time in Search and Maps","Technology giant Google has announced to introduce a feature to display waiting time for around a million restaurants in Search and Maps. Users will be able to check the estimated wait time under the 'Popular Times' section of a restaurant. It will also highlight the busiest time slots during the day and the approximate time people spent waiting in queue.","http://images.newsinshorts.com.edgesuite.net/app_assets/images/2017/8nov/inshorts_image_1510125312488_905.jpg?resize=400px:*","https://www.theverge.com/2017/11/7/16617500/google-restaurant-wait-times-maps-search?utm_source=inshorts&utm_medium=referral&utm_campaign=fullarticle ","vfywpmxt-1"
"805","technology","Apple says it pays every dollar owed in every country","Apple has said that it ""pays every dollar it owes in every country around the world"" in a statement regarding its offshore dealings revealed in Paradise Papers. Apple also said that shifting its facilities from Ireland to Jersey ""did not reduce [its] tax payments in any country."" Apple added that it is the largest taxpayer in the world.","http://images.newsinshorts.com.edgesuite.net/app_assets/images/2017/7nov/inshorts_image_1510054744384_898.jpg?resize=400px:*","https://www.engadget.com/2017/11/07/apple-jersey-taxes/?utm_source=inshorts&utm_medium=referral&utm_campaign=fullarticle ","vfywpmxt-1"
"806","technology","Users claim Apple Watch crashes when asked about weather","Some Apple Watch users have reported that their Watches crashed when they asked Siri about the weather, earlier this week. The issue seems to be impacting users in Canada, Europe and the US. It is reportedly affecting both LTE and GPS Apple Watch Series 3 as well as older Apple Watch models.","http://images.newsinshorts.com.edgesuite.net/app_assets/images/2017/6nov/inshorts_image_1509955409101_989.jpg?resize=400px:*","https://www.engadget.com/2017/11/05/apple-watch-siri-weather-crash/?utm_source=inshorts&utm_medium=referral&utm_campaign=fullarticle ","vfywpmxt-1"
"807","technology","Google rolls out update for Pixel 2, XL for screen burn-in","Technology giant Google has started rolling out an update for its Pixel 2 and Pixel 2 XL smartphones including new Saturated colour mode. This comes after users reported Pixel 2 XL's screens turning grey, suggesting burn-in. The update also includes a fix for the faint clicking noise heard in some Pixel 2 phones, the company said.","http://images.newsinshorts.com.edgesuite.net/app_assets/images/2017/7nov/inshorts_image_1510056806352_144.jpg?resize=400px:*","https://www.engadget.com/2017/11/07/google-pixel-2-xl-update-display/?utm_source=inshorts&utm_medium=referral&utm_campaign=fullarticle ","vfywpmxt-1"
"808","technology","Russian social network lets users be anonymous for 24 hrs","Russian social media network VKontakte allowed its users to remain anonymous for a day, letting them post on their friends' timelines with their name and profile picture hidden. The event was dedicated to mark Guy Fawkes' failed attempt to blow up the British Parliament on November 5, 1605. VKontakte considers Guy Fawkes' 'V' mask ""a symbol of freedom and justice"".\n","http://images.newsinshorts.com.edgesuite.net/app_assets/images/2017/7nov/inshorts_image_1510032705846_212.jpg?resize=400px:*","https://www.rt.com/news/408939-russian-vk-anonymous-day/?utm_source=inshorts&utm_medium=referral&utm_campaign=fullarticle ","vfywpmxt-1"
"809","technology","I start lots of books but finish few of them: Satya Nadella","Microsoft's India-born CEO Satya Nadella, while speaking at a recent event revealed his weakness and said that he starts lots of books but finishes a few of them. On being asked if his heart is in Redmond or Hyderabad, Nadella said that both of them are a part of his life. Nadella launched his first book 'Hit Refresh' in September.","http://images.newsinshorts.com.edgesuite.net/app_assets/images/2017/7nov/inshorts_image_1510047827372_809.jpg?resize=400px:*","http://indiatoday.intoday.in/technology/story/india-today-conclave-next-2017-satya-nadella-says-future-is-all-about-mixed-reality-ai-and-quantum-computing/1/1083908.html?utm_source=inshorts&utm_medium=referral&utm_campaign=fullarticle ","vfywpmxt-1"
"810","technology","Google rolls out song identification feature in Assistant ","Google has rolled out a feature in its digital assistant called 'Google Assistant' to identify songs playing around users. The Assistant will pull up a card with information about the song on asking ""what song is this?"" or ""what song is playing?"" The card will also have links to YouTube, Google Play Music and Spotify streaming links of the song.","http://images.newsinshorts.com.edgesuite.net/app_assets/images/2017/7nov/inshorts_image_1510040305208_371.jpg?resize=400px:*","http://www.hindustantimes.com/tech/google-assistant-can-now-identify-which-song-is-playing-near-you/story-Gw4A2AaiLzFGO4R7auI9JP.html?utm_source=inshorts&utm_medium=referral&utm_campaign=fullarticle ","vfywpmxt-1"
"811","technology","Robots complete 2-hour task in 5 min at online grocer Ocado","UK-based online grocer Ocado has used a fleet of 1,000 robots to complete a task in 5 minutes, while a similar task took around two hours to complete earlier. Moving at 4 metres per second, the robots are controlled by software that knows which items are needed at any given time. Reportedly, the automation helps cut wastage and predict demand.","http://images.newsinshorts.com.edgesuite.net/app_assets/images/2017/6nov/inshorts_image_1509975198134_755.jpg?resize=400px:*","https://www.bloomberg.com/news/articles/2017-11-06/how-many-robots-does-it-take-to-fill-a-grocery-order?utm_source=inshorts&utm_medium=referral&utm_campaign=fullarticle ","vfywpmxt-1"
"812","technology","Snapchat faces four hours of global outage","Photo-sharing app Snapchat went down for at least four hours on Monday affecting its users worldwide. Users said that they were unable to sign in and the app displayed a message which read, 'could not connect'. Snapchat said it was aware of the issue and recommended users to stay logged into their accounts. ","http://images.newsinshorts.com.edgesuite.net/app_assets/images/2017/7nov/inshorts_image_1510033196302_971.jpg?resize=400px:*","http://fortune.com/2017/11/06/snapchat-suffers-outage/?utm_source=inshorts&utm_medium=referral&utm_campaign=fullarticle ","vfywpmxt-1"
"813","technology","Samsung to pay Apple $120 mn in slide-to-unlock patent case","The US Supreme Court has rejected a request by Samsung to re-evaluate a $120 million award granted to Apple in a patent infringement lawsuit. The case which dates back to 2014, found the South Korean technology giant guilty of infringing Apple's slide-to-unlock patent, among others. Samsung said that the court's decision allows Apple to ""unjustly profit"" from the patent.","http://images.newsinshorts.com.edgesuite.net/app_assets/images/2017/7nov/inshorts_image_1510042500854_772.jpg?resize=400px:*","https://www.theverge.com/2017/11/6/16614038/apple-samsung-slide-to-unlock-supreme-court-120-million?utm_source=inshorts&utm_medium=referral&utm_campaign=fullarticle ","vfywpmxt-1"
