"ind","catg","headline","body","imageurl","readmoreurl","inblockId"
"270","technology","Kohler unveils toilet that opens itself when user approaches","American company Kohler has unveiled Numi intelligent toilet at the Consumer Electronics Show (CES) 2018, which can automatically open up its lid when a user approaches it. The toilet offers a foot warmer, heated seat, automatic flush, and personalised cleansing functionality. It can also play music, can be operated via voice-commands and automatically close its lid after the use.","http://images.newsinshorts.com.edgesuite.net/app_assets/images/2018/9jan/inshorts_image_1515487918942_100.jpg?resize=400px:*","https://techcrunch.com/2018/01/08/kohler-wants-to-make-your-bathroom-smarter-with-konnect/?utm_source=inshorts&utm_medium=referral&utm_campaign=fullarticle ","ynompoqt-2"
"271","technology","Smart insoles to track user's fatigue level developed","French footwear manufacturer Zhor Tech has unveiled smart insoles at CES 2018, which can track a user's fatigue levels via an app. Priced at $149, the insoles feature sensors that also count users' steps, analyse posture and detect surrounding vibrations. Users can view detailed, real-time information using a connected app and share it with other users. ","http://images.newsinshorts.com.edgesuite.net/app_assets/images/2018/8jan/inshorts_image_1515412090124_562.jpg?resize=400px:*","https://www.engadget.com/2018/01/07/zhor-tech-smart-insole/?utm_source=inshorts&utm_medium=referral&utm_campaign=fullarticle ","ynompoqt-2"
"272","technology","Nokia unveils sleep tracker to monitor user's snoring","Nokia has unveiled a sleep tracking system called Nokia Sleep at CES 2018 which can monitor a user's snoring. The device, built into a mattress pad, has movement sensors and software algorithms to record user's sleep patterns while synced to Nokia's Health Mate app. It can also regulate the room temperature and turn off lights when a user falls asleep. ","http://images.newsinshorts.com.edgesuite.net/app_assets/images/2018/9jan/inshorts_image_1515487348987_879.jpg?resize=400px:*","https://www.bloomberg.com/news/articles/2018-01-09/nokia-launches-sleep-tracker-for-beds-after-apple-buys-startup?utm_source=inshorts&utm_medium=referral&utm_campaign=fullarticle ","ynompoqt-2"
"273","technology","Electronic capsule can detect different gases in human gut","Australia-based researchers have developed a swallowable electronic capsule that can detect different gases in the human gut. Trials on seven individuals showed the human stomach uses an oxidiser to fight foreign bodies in the gut, a finding ""never reported before"". The team is aiming to commercialise the technology for diagnosing food malabsorption and colon cancer.","http://images.newsinshorts.com.edgesuite.net/app_assets/images/2018/10jan/inshorts_image_1515570033326_949.jpg?resize=400px:*","https://www.rmit.edu.au/news/all-news/2018/jan/swallowable-sensors-reveal-gut-health-mysteries?utm_source=inshorts&utm_medium=referral&utm_campaign=fullarticle ","ynompoqt-2"
"274","technology","Paid for hookers, porn using cryptocurrency, admits McAfee","Cybersecurity expert John McAfee on Monday tweeted that he has used cryptocurrency to pay for prostitutes, drugs and pornography. Earlier the same day, McAfee said that he had used cryptocurrency for ""food, entertainment, clothing, homes, and sex for hire services"" in the past.\nRecently, he began issuing weekly recommendations about cryptocurrencies under the headline of 'Coin Of The Week'.","http://images.newsinshorts.com.edgesuite.net/app_assets/images/2018/9jan/inshorts_image_1515499002457_458.jpg?resize=400px:*","http://www.ibtimes.co.uk/john-mcafee-says-he-paid-hookers-illegal-drugs-porn-using-cryptocurrency-1654252?utm_source=inshorts&utm_medium=referral&utm_campaign=fullarticle ","ynompoqt-2"
"275","technology","Startup develops shoes which sends alerts if a user falls","French startup E-Vone has unveiled smart shoes with falling alerts at Consumer Electronics Show (CES) 2018 which notifies family or medical services if a user takes a fall. The shoes feature GPS, accelerometer and a pressure system which activates the alarm when someone wears them. They're designed for elderly people, construction workers and hikers among others, according to the startup. ","http://images.newsinshorts.com.edgesuite.net/app_assets/images/2018/8jan/inshorts_image_1515403814147_222.jpg?resize=400px:*","https://www.engadget.com/2018/01/07/e-vone-smart-shoes/?utm_source=inshorts&utm_medium=referral&utm_campaign=fullarticle ","ynompoqt-2"
"276","technology","Head of Google's Allo, Duo Amit Fulay quits to join Facebook","Amit Fulay, Head of Product for Real Time Communications at Google has quit the search giant to join social media major Facebook, he announced on Twitter. ""The last 7.5 years have been nothing short of amazing at Google,"" he said. Fulay helped Google build communication apps Allo, Duo, and Hangouts, and previously served Microsoft as its Lead Program Manager.","http://images.newsinshorts.com.edgesuite.net/app_assets/images/2018/9jan/inshorts_image_1515489438718_298.jpg?resize=400px:*","http://indiatoday.intoday.in/technology/story/amit-fulay-head-of-allo-and-duo-leaves-google-to-join-facebook/1/1126538.html?utm_source=inshorts&utm_medium=referral&utm_campaign=fullarticle ","ynompoqt-2"
"277","technology","SpaceX loses 'secret' US govt satellite after latest launch","SpaceX has reportedly lost the 'secret' satellite Zuma commissioned by the US government after it failed to reach the orbit. The Strategic Command, which monitors man-made objects in space, said it did not track any new satellites since the launch. Reports suggest that the payload did not separate from the Falcon 9's upper stage and fell back to Earth.","http://images.newsinshorts.com.edgesuite.net/app_assets/images/2018/9jan/inshorts_image_1515470890555_442.jpg?resize=400px:*","https://techcrunch.com/2018/01/08/spacex-apparently-lost-the-classified-zuma-payload-from-latest-launch/?utm_source=inshorts&utm_medium=referral&utm_campaign=fullarticle ","ynompoqt-2"
"278","technology","Apple should address iPhone addiction among youth: Investors","In a letter to Apple, investors Jana Partners and the California State Teachers' Retirement System (CalSTRS) have urged the smartphone maker to address the growing addiction of iPhones among youth. They also asked the company to consider developing software that will let parents limit children's phone usage. Jana and CalSTRS together reportedly control Apple shares worth about $2 billion.","http://images.newsinshorts.com.edgesuite.net/app_assets/images/2018/8jan/inshorts_image_1515401817877_477.jpg?resize=400px:*","http://www.hindustantimes.com/tech/investors-ask-apple-to-address-smartphone-addiction-among-youth/story-keYrkx6fU08s3U71zI7JtK.html?utm_source=inshorts&utm_medium=referral&utm_campaign=fullarticle ","ynompoqt-2"
"279","technology","Chinese startup unveils concept car with face scanning tech","Chinese electric car manufacturing startup Byton has unveiled a concept car called Byton at CES 2018, equipped with facial recognition technology to unlock the doors. Priced at $45,000, the electric SUV has a driving range of 400 km for the base model. It also features self-driving technology, touch control, internet connectivity and voice recognition using Amazon's digital assistant, Alexa.","http://images.newsinshorts.com.edgesuite.net/app_assets/images/2018/8jan/inshorts_image_1515423984057_765.jpg?resize=400px:*","https://www.bloomberg.com/news/articles/2018-01-08/a-45-000-suv-shown-in-las-vegas-attests-to-china-s-car-ambition?utm_source=inshorts&utm_medium=referral&utm_campaign=fullarticle ","ynompoqt-2"
"280","technology","Arrest UIDAI, not journos: Snowden on Aadhaar leak report","American whistleblower Edward Snowden has said UIDAI authorities should be arrested not the journalists for the alleged Aadhaar data breach. Earlier, The Tribune newspaper's journalist Rachna Khaira reported that ""unrestricted access"" to Aadhaar data could be availed from anonymous sellers for ₹500. The UIDAI later denied any breach and filed an FIR against the newspaper and Khaira for the same.","http://images.newsinshorts.com.edgesuite.net/app_assets/images/2018/9jan/inshorts_image_1515485742274_511.jpg?resize=400px:*","http://indiatoday.intoday.in/story/aadhaar-uidai-authorities-not-journalist-behind-data-breach-story-should-be-arrested-says-edward-snowden/1/1126486.html?utm_source=inshorts&utm_medium=referral&utm_campaign=fullarticle ","ynompoqt-2"
"281","technology","Met my wife as a prostitute five years ago: John McAfee","Cybersecurity expert John McAfee on Monday revealed that he met his wife as a prostitute five years back. In a tweet, he said it ""always seemed fair"" to him to pay for prostitutes and that he would not have met his wife otherwise. He had earlier tweeted that he paid for prostitutes, drugs, and pornography using cryptocurrencies whenever possible.","http://images.newsinshorts.com.edgesuite.net/app_assets/images/2018/9jan/inshorts_image_1515504481378_248.jpg?resize=400px:*","https://twitter.com/officialmcafee/status/950331097912619008?utm_source=inshorts&utm_medium=referral&utm_campaign=fullarticle ","ynompoqt-2"
"282","technology","Suicide not a joke: YouTube on video showing suicide victim","Slamming YouTuber Logan Paul's video which showed a suicide victim's body in Japan, YouTube tweeted suicide is ""not a joke"" and should never be a driving force for views. Adding that Paul's channel violated community guidelines, the video-sharing website said it's looking at ""further consequences"". Earlier, Paul uploaded the video blurring the victim's face but removed it within 24 hours.","http://images.newsinshorts.com.edgesuite.net/app_assets/images/2018/10jan/inshorts_image_1515558741215_718.jpg?resize=400px:*","https://techcrunch.com/2018/01/09/youtube-offers-non-apology-over-logan-paul-controversy/?utm_source=inshorts&utm_medium=referral&utm_campaign=fullarticle ","ynompoqt-2"
"283","technology","Belt with airbags to protect a user's hips from fall made","French airbag manufacturer Helite has unveiled a belt called Hip'Air at CES 2018 which contains airbags to protect a user's hips in case of a fall. Hip'Air, which is reportedly priced at $800, also contains a battery and sensors which detect the fall within 0.2 seconds. The airbags inflate right above the hips to allegedly absorb 90% of the impact.","http://images.newsinshorts.com.edgesuite.net/app_assets/images/2018/8jan/inshorts_image_1515414681756_527.jpg?resize=400px:*","https://www.theverge.com/2018/1/7/16860374/hipair-elderly-tech-health-fall-prevention-wearables-ces-2018?utm_source=inshorts&utm_medium=referral&utm_campaign=fullarticle ","ynompoqt-2"
"284","technology","Delhi to create 1.5L tonnes e-waste per yr by 2020: Assocham","The Delhi-National Capital Region (NCR) is likely to generate about 1.5 lakh metric tonne of e-waste in a year by 2020, industry body Assocham has said. Adding that e-waste contains toxic substances like lead, It attributed factors like low organised recycling, cross-border flow of waste equipment into the country and limited awareness regarding disposal for the same.","http://images.newsinshorts.com.edgesuite.net/app_assets/images/2018/9jan/inshorts_image_1515498162639_778.jpg?resize=400px:*","http://www.newindianexpress.com/business/2018/jan/09/delhi-ncr-to-generate-150-lakh-mt-e-waste-by-2020-assocham-1748713.html?utm_source=inshorts&utm_medium=referral&utm_campaign=fullarticle ","ynompoqt-2"
"285","technology","Steve Jobs prank called Starbucks while unveiling 1st iPhone","During the introduction of the first iPhone, the then Apple CEO Steve Jobs made a public prank call ordering ""4,000 lattes to go"" from a nearby Starbucks. The call, which Jobs made while demonstrating the working of Google Maps, was also the first ever phone call made on an iPhone. Notably, the first iPhone was unveiled on January 9, 2007. ","http://images.newsinshorts.com.edgesuite.net/app_assets/images/2018/9jan/inshorts_image_1515481621203_139.jpg?resize=400px:*","https://www.theverge.com/2013/3/4/4063272/meet-starbucks-barista-that-took-steve-jobs-4000-latte-order-iphone?utm_source=inshorts&utm_medium=referral&utm_campaign=fullarticle ","ynompoqt-2"
"286","technology","Thumbnail-sized UV sensor to track sun exposure made","Cosmetics giant L'Oreal has introduced a thumbnail-sized wearable UV sensor called 'UV Sense' at CES 2018, which can track sun exposure via an app. UV Sense, a battery-free electronic sensor, is NFC-enabled which allows users to retrieve the data collected using the app. The sensor, that comes with replaceable adhesive, can be pasted on one's fingernail or sunglasses.","http://images.newsinshorts.com.edgesuite.net/app_assets/images/2018/8jan/inshorts_image_1515412904025_329.jpg?resize=400px:*","https://www.theverge.com/circuitbreaker/2018/1/7/16861722/loreal-uv-sensor-nail-sticker-nfc-announced-ces-2018?utm_source=inshorts&utm_medium=referral&utm_campaign=fullarticle ","ynompoqt-2"
"287","technology","Kerala to get robots to clean sewers, end manual scavenging","In a bid to end the practice of manual scavenging, the Kerala government is procuring 50 robots which are developed to clean sewer holes. The robot, named 'Bandicoot', has been developed by Kerala-based startup 'Genrobotics'. The robot has four limbs along with a bucket system and can go into a sewer hole, identify the problem and clean sewer holes. ","http://images.newsinshorts.com.edgesuite.net/app_assets/images/2018/7jan/inshorts_image_1515344913665_337.jpg?resize=400px:*","http://www.hindustantimes.com/india-news/kerala-startup-finds-robotic-solution-to-end-sewer-cleaning-deaths/story-zRqpOeQP6F1YMbFqEMmdYI.html?utm_source=inshorts&utm_medium=referral&utm_campaign=fullarticle ","ynompoqt-2"
"288","technology","Facebook exploring how to use cryptocurrencies: Zuckerberg","Facebook CEO Mark Zuckerberg has said that the social media giant is studying cryptocurrencies and how to use them on the platform. Warning that they will be harder to control, Zuckerberg said cryptocurrencies take power from centralised systems and put it back into people's hands. Zuckerberg said this in a post explaining his personal challenge for the year.","http://images.newsinshorts.com.edgesuite.net/app_assets/images/2018/5jan/inshorts_image_1515168039320_227.jpg?resize=400px:*","https://www.bloomberg.com/news/articles/2018-01-04/mark-zuckerberg-says-facebook-to-look-into-cryptocurrency?utm_source=inshorts&utm_medium=referral&utm_campaign=fullarticle ","omupm0m0-1"
"289","technology","China to build AI development park worth over ₹13,400 crore","China has released a plan to build a technology park for the development of artificial intelligence (AI) at a cost over ₹13,400 crore (￥13.8 billion). It is aimed at attracting enterprises that work on big-data, biometric identification and cloud computing. Estimates claim that the park will generate an annual output value of about ₹48,800 crore (￥50 billion).","http://images.newsinshorts.com.edgesuite.net/app_assets/images/2018/5jan/inshorts_image_1515142958568_523.jpg?resize=400px:*","https://www.reuters.com/article/us-china-artificial-intelligence/beijing-to-build-2-billion-ai-research-park-xinhua-idUSKBN1ES0B8?utm_source=inshorts&utm_medium=referral&utm_campaign=fullarticle ","omupm0m0-1"
"290","technology","Android malware mimics Uber app to get login, password data","A variant of Android.Fakeapp malware is targeting Android users using a fake version of the Uber app to steal login and password data, according to US-based cybersecurity firm Symantec. The malware immediately sends the credentials to its remote server after users log in. It also displays a screen of the original Uber app with users' current location to appear convincing.","http://images.newsinshorts.com.edgesuite.net/app_assets/images/2018/7jan/inshorts_image_1515307533725_160.jpg?resize=400px:*","http://www.ibtimes.co.in/uber-users-android-beware-this-malware-can-steal-your-credentials-hide-heist-using-deep-links-755776?utm_source=inshorts&utm_medium=referral&utm_campaign=fullarticle ","omupm0m0-1"
"291","technology","SpaceX launches 'secret' satellite on its 1st flight of 2018","Elon Musk-led SpaceX has launched the Zuma spacecraft commissioned by the US government for an undisclosed mission on its first flight of 2018. The launch was followed by a recovery of the first stage booster used with the Falcon 9 rocket. In 2017, SpaceX launched 18 rockets, setting the record for most launches in one year by a private company.","http://images.newsinshorts.com.edgesuite.net/app_assets/images/2018/8jan/inshorts_image_1515396603272_722.jpg?resize=400px:*","https://techcrunch.com/2018/01/07/spacex-successfully-launches-top-secret-zuma-spacecraft/?utm_source=inshorts&utm_medium=referral&utm_campaign=fullarticle ","omupm0m0-1"
"292","technology","Samsung unveils 146-inch 4K modular TV called 'The Wall'","Electronics giant Samsung has unveiled a 146-inch 4K modular TV called 'The Wall' which it claims to be ""the world's first modular TV"", at electronics show CES 2018. According to Samsung, ""Users can add or remove modules to make their TV bigger or smaller."" Further, The Wall has a bezel-less design and uses MicroLED technology to produce the picture. ","http://images.newsinshorts.com.edgesuite.net/app_assets/images/2018/8jan/inshorts_image_1515401188407_485.jpg?resize=400px:*","https://www.theverge.com/circuitbreaker/2018/1/7/16861790/samsung-the-wall-microled-modular-tv-announced-ces-2018?utm_source=inshorts&utm_medium=referral&utm_campaign=fullarticle ","omupm0m0-1"
"293","technology","Acer unveils world's thinnest laptop measuring 0.35 inches","Taiwanese company Acer has unveiled a laptop, Swift 7 Ultrabook, which it claims is the world's thinnest computer with a thickness of 8.98 mm (0.35 inches). The laptop, priced at $1,699, comes with 8 GB RAM and 256 GB of storage. It features an all-black unibody construction, 14-inch display and is said to have about 10 hours of battery life.","http://images.newsinshorts.com.edgesuite.net/app_assets/images/2018/1jan/7/zqjbxgir-1-1515335898250.jpg?resize=400px:*","http://www.bgr.in/news/ces-2018-acer-unveils-4-new-laptops-including-the-worlds-thinnest-swift-7-ultrabook/?utm_source=inshorts&utm_medium=referral&utm_campaign=fullarticle ","omupm0m0-1"
"294","technology","Chinese firm Doogee launches phone with 12,000mAh battery","Chinese smartphone manufacturer Doogee has launched a smartphone called Doogee BL12000 featuring a 12,000 mAh battery, which the company claims can recharge fully in 4 hours. The smartphone features a 6-inch FHD display with dual-cameras on both its front and back. It also comes with facial recognition technology which the firm calls ""Face ID"".","http://images.newsinshorts.com.edgesuite.net/app_assets/images/2018/7jan/inshorts_image_1515325216337_246.jpg?resize=400px:*","http://www.ibtimes.co.in/battery-life-your-biggest-concern-heres-smartphone-jaw-dropping-battery-capacity-756032?utm_source=inshorts&utm_medium=referral&utm_campaign=fullarticle ","omupm0m0-1"
"295","technology","Apple App Store earned double of Google Play in 2017: Report","Apple's App Store saw consumer spending of about $38.5 billion in 2017, nearly double the $20.1 billion spent on Google Play, according to Sensor Tower. Users spent $58.6 billion on apps and games through in-app purchases on the two stores during the year. There was a 35% year-over-year increase from 2016, where consumers spent $43.5 billion across both stores.","http://images.newsinshorts.com.edgesuite.net/app_assets/images/2018/6jan/inshorts_image_1515240124753_956.jpg?resize=400px:*","https://sensortower.com/blog/app-revenue-and-downloads-2017?utm_source=inshorts&utm_medium=referral&utm_campaign=fullarticle ","omupm0m0-1"
"296","technology","Samsung patent reveals Apple's 3D Touch-like feature","Technology giant Samsung's recently filed patent has revealed a pressure sensitive display similar to the 3D Touch feature released by Apple. The pressure-sensitive technology has already been implemented around the virtual home button in Samsung Galaxy S8 and S8+. However, there is no confirmation if this technology would feature on the company's foldable smartphone reportedly called 'Galaxy X'.","http://images.newsinshorts.com.edgesuite.net/app_assets/images/2018/7jan/inshorts_image_1515312718322_364.jpg?resize=400px:*","http://www.ibtimes.co.in/watch-out-apple-samsung-galaxy-x-may-feature-technology-similar-iphones-3d-touch-755823?utm_source=inshorts&utm_medium=referral&utm_campaign=fullarticle ","omupm0m0-1"
"297","technology","Samsung unveils laptop with 360-degree rotating display","South Korean electronics giant Samsung has unveiled 'Notebook 7 Spin' multi-functional laptop with a 360-degree rotating touchscreen display. The laptop features a fingerprint sensor for authentication and also supports an Active Pen stylus, which will be sold separately. It comes with a 13.3-inch display along with 8 GB RAM and 256 GB of SSD storage. ","http://images.newsinshorts.com.edgesuite.net/app_assets/images/2018/7jan/inshorts_image_1515329485942_155.jpg?resize=400px:*","https://www.theverge.com/circuitbreaker/2018/1/5/16851934/samsung-notebook-7-spin-intel-8th-gen-processor-active-pen-update-ces-2018?utm_source=inshorts&utm_medium=referral&utm_campaign=fullarticle ","omupm0m0-1"
"298","technology","Group representing FB, Google to join net neutrality lawsuit","US Internet Association has announced intent to act as an intervenor in the lawsuit against the Federal Communications Commission (FCC) over its decision to repeal net neutrality. The Association which represents companies like Amazon, Facebook, and Google said the decision ""fails to preserve a free"" internet. This comes after the FCC published the text of order repealing net neutrality rules.","http://images.newsinshorts.com.edgesuite.net/app_assets/images/2018/6jan/inshorts_image_1515213610907_280.jpg?resize=400px:*","https://www.engadget.com/2018/01/05/net-neutrality-suit-support-biggest-tech-companies/?utm_source=inshorts&utm_medium=referral&utm_campaign=fullarticle ","omupm0m0-1"
"299","technology","GoPro lays off 200 employees from drone division: Reports","American consumer electronics company GoPro laid off around 200 to 300 workers this week, primarily from its drone business unit, according to reports. GoPro also sent letters to the impacted employees, explaining that the lay offs are intended to ""better align"" the company's resources with business requirements, reports added. GoPro will keep the fired employees on payroll until February 16.","http://images.newsinshorts.com.edgesuite.net/app_assets/images/2018/6jan/inshorts_image_1515223568910_698.jpg?resize=400px:*","http://fortune.com/2018/01/05/gopro-layoff-karma-drone/?utm_source=inshorts&utm_medium=referral&utm_campaign=fullarticle ","omupm0m0-1"
"300","technology","Smart glove which allows movement of paralysed hands made","South Korean company Neofect has unveiled a smart glove 'NeoMano' which allows movement of paralysed hands for activities like turning pages or opening doors. The glove is connected to a control panel with a battery module on the bridge of the hand. The prototype consists of leather wrapped around the heel of the hand, two fingers, and a thumb.","http://images.newsinshorts.com.edgesuite.net/app_assets/images/2018/8jan/inshorts_image_1515398322149_581.jpg?resize=400px:*","https://techcrunch.com/2018/01/07/the-neomano-robotic-glove-brings-control-back-to-paralyzed-hands/?utm_source=inshorts&utm_medium=referral&utm_campaign=fullarticle ","omupm0m0-1"
"301","technology","LG unveils 65-inch OLED TV which can roll up like paper","South Korean electronics company LG's subsidiary LG Display has unveiled a 65-inch OLED TV which can roll up like paper. The rollable display prototype, which also features 4K resolution, is expected to be demonstrated at electronics show CES this week. LG is also expected to showcase an 88-inch OLED display TV with 8K resolution at the upcoming event.","http://images.newsinshorts.com.edgesuite.net/app_assets/images/2018/7jan/inshorts_image_1515310936177_685.jpg?resize=400px:*","https://www.theverge.com/2018/1/6/16859102/lg-display-rollable-oled-65-inch-ces-2018?utm_source=inshorts&utm_medium=referral&utm_campaign=fullarticle ","omupm0m0-1"
"302","technology","Google losing up to 250 bicycles every week: Report","Tech giant Google is losing up to 250 of its multicoloured bicycles called GBikes every week, according to The Wall Street Journal. The bikes which cost $100-300 have reportedly been found on the roof of a pub and in a TV commercial. The locals in Mountain View, where Google is based, reportedly consider GBikes souvenir from Google.","http://images.newsinshorts.com.edgesuite.net/app_assets/images/2018/7jan/inshorts_image_1515334813782_719.jpg?resize=400px:*","http://www.ibtimes.co.in/whats-so-special-about-these-bicycles-that-google-loses-nearly-250-them-every-week-756045?utm_source=inshorts&utm_medium=referral&utm_campaign=fullarticle ","omupm0m0-1"
"303","technology","Reddit admits being hacked amid stolen Bitcoin Cash reports","Online discussions platform Reddit has confirmed that its email provider was hacked, amid reports of Bitcoin Cash being stolen from users' accounts. The platform's third-party password reset system was breached, allowing access to multiple users' accounts, according to Reddit. The website also claimed it moved all reset emails to an in-house mail server soon after being notified about the breach. ","http://images.newsinshorts.com.edgesuite.net/app_assets/images/2018/7jan/inshorts_image_1515310291967_214.jpg?resize=400px:*","https://thenextweb.com/hardfork/2018/01/05/reddit-bitcoin-cash-hack/?utm_source=inshorts&utm_medium=referral&utm_campaign=fullarticle ","omupm0m0-1"
