"ind","catg","headline","body","imageurl","readmoreurl","inblockId"
"786","startup","Will support startups with passionate founders: Ratan Tata","Tata group chairman emeritus Ratan Tata in an interview on Wednesday said that he will support startups with founders who have passion to build a sustainable company. He also said one would not want to work with a founder who wants to scale up a company just to sell it. Tata has invested in startups including Snapdeal, Ola, and Xiaomi.","http://images.newsinshorts.com.edgesuite.net/app_assets/images/2017/21sep/inshorts_image_1505992863228_913.jpg?resize=400px:*","http://www.hindustantimes.com/business-news/will-support-startups-with-passionate-founders-ratan-tata/story-l5zu9dDOD1VSlh4bjbydTO.html?utm_source=inshorts&utm_medium=referral&utm_campaign=fullarticle ","rbu5efup-1"
"787","startup","Tesla to make own chip with AMD for self-driving car: Report","Elon Musk-led electric car maker Tesla is working with US-based Advanced Micro Devices (AMD) to make its own chip for self-driving cars, according to reports. Tesla also recently hired the ex-AMD executive Jim Keller as head of its Autopilot hardware engineering effort. The carmaker reportedly has already received samples of the first implementation of its processor.","http://images.newsinshorts.com.edgesuite.net/app_assets/images/2017/21sep/inshorts_image_1505982997917_591.jpg?resize=400px:*","https://www.theverge.com/2017/9/20/16341478/tesla-amd-chip-self-driving-car?utm_source=inshorts&utm_medium=referral&utm_campaign=fullarticle ","rbu5efup-1"
"788","startup","MakeMyTrip India CEO rejoins Flipkart board after two years","MakeMyTrip Co-founder and CEO-India Rajesh Magow has rejoined homegrown e-commerce startup Flipkart's board after two years. Magow had first joined Flipkart's board in March, 2011 before leaving in May, 2015. According to reports, Magow, who was Chief Financial officer at MakeMyTrip before becoming CEO, has come back to the position to help Flipkart hold its initial public offering.","http://images.newsinshorts.com.edgesuite.net/app_assets/images/2017/22sep/inshorts_image_1506070017542_605.jpg?resize=400px:*","http://www.livemint.com/Companies/3AyBWYDUVsnIz2Rtk3dwVI/MakeMyTrip-CEO-Rajesh-Magow-rejoins-Flipkart-board-after-2-y.html?utm_source=inshorts&utm_medium=referral&utm_campaign=fullarticle ","rbu5efup-1"
"789","startup","Fintech startup GoCardless raises $22.5 million","UK-based fintech startup GoCardless has raised $22.5 million (about ₹145 crore) in a Series D funding round led by Accel Partners. Investors Balderton, Notion, and Passion Capital also participated in the funding round. Founded in 2011, GoCardless allows companies to collect recurring or instalment payments from their costumers using an online dashboard or the startup's own API. ","http://images.newsinshorts.com.edgesuite.net/app_assets/images/2017/19sep/inshorts_image_1505824247221_603.jpg?resize=400px:*","https://techcrunch.com/2017/09/19/go-gocardless/?utm_source=inshorts&utm_medium=referral&utm_campaign=fullarticle ","rbu5efup-1"
"790","startup","Delhi HC issues warrant against AskMe's former MD ","The Delhi High Court has issued a bailable warrant against Sanjiv Gupta, the former Managing Director of now-defunct online retailer AskMe. The warrant was issued after Gupta apparently failed to appear before the liquidator investigating the alleged 'fraud' at AskMe. The liquidation of the retailer was initiated earlier this year after vendors filed for outstanding claims against AskMe.","http://images.newsinshorts.com.edgesuite.net/app_assets/images/2017/20sep/inshorts_image_1505900054412_722.jpg?resize=400px:*","https://inc42.com/buzz/askme-sanjiv-gupta-high-court-getit/?utm_source=Inc42+Main&utm_campaign=04b55d07dc-Daily_Newsletter_317&utm_medium=email&utm_term=0_849f9683a8-04b55d07dc-107253697&utm_source=inshorts&utm_medium=referral&utm_campaign=fullarticle ","rbu5efup-1"
"791","startup","Yatra raises ₹100 crore in largest venture debt in India ","Online travel company Yatra has raised ₹100 crore in India's largest venture debt funding from InnoVen Capital. Yatra's Chief Financial Officer Alok Vaish said this funding provides additional capital for the company's growth. Founded in 2006 by Dhruv Shringi, Manish Amin, and Sabina Chopra, Yatra provides travel-related services like hotel bookings and holiday packages among other services. ","http://images.newsinshorts.com.edgesuite.net/app_assets/images/2017/21sep/inshorts_image_1506003238824_485.jpg?resize=400px:*","http://www.livemint.com/Companies/nenINISyuFYIemCFx28fNN/Yatra-raises-Rs100-crore-venture-debt-from-InnoVen-Capital.html?utm_source=inshorts&utm_medium=referral&utm_campaign=fullarticle ","rbu5efup-1"
"792","startup","Apple iOS 11 limits Uber's access to users' location","Technology giant Apple's latest mobile operating system iOS 11 limits ride-hailing startup Uber's access to users' location. The new update allows users to share their location with Uber while using the app. Earlier, users only had the option of giving Uber complete access to track their location or block it, which would make the app unusable. ","http://images.newsinshorts.com.edgesuite.net/app_assets/images/2017/22sep/inshorts_image_1506095144775_149.jpg?resize=400px:*","http://mashable.com/2017/09/21/ios-11-uber-location-tracking/?utm_cid=hp-hh-sec&utm_source=inshorts&utm_medium=referral&utm_campaign=fullarticle#lrQDDfvnukq3 ","rbu5efup-1"
"793","startup","Flipkart lists Amazon exclusive TCL products on its website","E-commerce giant Flipkart has listed Chinese electronics company TCL's products on its platform when Amazon is the exclusive partner for the brand in India. On enquiry, TCL spokesperson Mike Chen confirmed the exclusive partnership with Amazon India and said, ""No manufacturer warranty and installation will be applicable on purchase of a TCL TV from any other online channel.""","http://images.newsinshorts.com.edgesuite.net/app_assets/images/2017/20sep/inshorts_image_1505915358587_337.jpg?resize=400px:*","https://www.flipkart.com/search?q=TCL%20tv&otracker=start&as-show=off&as=off&utm_source=inshorts&utm_medium=referral&utm_campaign=fullarticle ","rbu5efup-1"
"794","startup","Hyperloop One raises $85 mn at a valuation of $700 mn","Hyperloop One on Thursday announced it has raised $85 million reportedly valuing the company at $700 million. The round saw participation from existing investors including Caspian VC Partners and OurCrowd.com. Founded in 2014, the high-speed transportation technology startup, which identified Mumbai-Chennai as a potential hyperloop route, has a total funding of $245 million to date.","http://images.newsinshorts.com.edgesuite.net/app_assets/images/2017/22sep/inshorts_image_1506062484559_967.jpg?resize=400px:*","https://www.recode.net/2017/9/21/16344268/hyperloop-one-raised-85-million-tunnel-700-million-valuation?utm_source=inshorts&utm_medium=referral&utm_campaign=fullarticle ","rbu5efup-1"
"795","startup","Aditya Birla Group to shut down e-commerce site Abof.com","The Aditya Birla Group is set to shut down its flagship e-commerce site Abof.com, the company announced on Thursday. The company's HR director said 240 Abof employees will be given four and-a-half months' salary as compensation, in case they choose to quit. He added, ""Looking at how... long term e-commerce businesses continue to struggle... it didn't seem logical to continue"".","http://images.newsinshorts.com.edgesuite.net/app_assets/images/2017/22sep/inshorts_image_1506067789594_446.jpg?resize=400px:*","http://www.thenewsminute.com/article/aditya-birla-group-shut-ecommerce-site-abofcom-amidst-tough-competition-incumbents-68811?utm_source=inshorts&utm_medium=referral&utm_campaign=fullarticle ","rbu5efup-1"
"796","startup","Amazon mistakenly emails users about 'baby registry' gift","A technical glitch caused Amazon.com to mistakenly email some of its customers saying they had received a gift, the company said on Tuesday. The email displayed an image of an infant and told shoppers they had received a present from their baby registry. However, some recipients said they had not created baby registries and did not even have babies.","http://images.newsinshorts.com.edgesuite.net/app_assets/images/2017/9sep/20/me7jsukp-1-1505899017143.jpg?resize=400px:*","http://www.reuters.com/article/us-amazon-com-glitch/amazon-sends-accidental-gift-email-to-shoppers-due-to-glitch-idUSKCN1BV01F?il=0&utm_source=inshorts&utm_medium=referral&utm_campaign=fullarticle ","rbu5efup-1"
"797","startup","Fintech startup in Japan lets anyone hold a personal IPO ","Japanese fintech startup Valu, which is a cross between a trading platform and crowdfunding site, lets anyone from fishermen to YouTube celebrities hold a personal Initial Public Offering (IPO). Users can sell shares on its website to raise funds and attracts buyers by offering services. For example, a blogger may offer exclusive posts that can only be viewed by shareholders.","http://images.newsinshorts.com.edgesuite.net/app_assets/images/2017/21sep/inshorts_image_1505986533861_303.jpg?resize=400px:*","https://www.bloomberg.com/news/articles/2017-09-20/valu-the-startup-in-japan-that-lets-anyone-hold-a-personal-ipo?utm_source=inshorts&utm_medium=referral&utm_campaign=fullarticle ","rbu5efup-1"
"798","startup","Domestic worker arrested for burglary at Myntra CEO's house","The Bengaluru Police has arrested Myntra CEO Ananth Narayanan's domestic worker for allegedly stealing jewellery and valuables worth ₹1 crore from his house. Police are also looking for two other suspects, Narayanan's former driver who quit seven months ago, and the driver's sister. The three had reportedly used the family's vacation abroad as an opportunity for the burglary.","http://images.newsinshorts.com.edgesuite.net/app_assets/images/2017/20sep/inshorts_image_1505924820904_901.jpg?resize=400px:*","http://www.thenewsminute.com/article/cops-nab-domestic-worker-myntra-ceo-house-burglary-valuables-worth-1-crore-untraced-68720?utm_source=inshorts&utm_medium=referral&utm_campaign=fullarticle ","rbu5efup-1"
"799","startup","Chris Gayle picks up stake in Bengaluru startup FlippAR","Windies cricketer Chris Gayle has picked up a minority stake in Bengaluru-based augmented reality startup FlippAR. The startup's Founder Vivek Jain said Gayle will endorse the brand in lieu of his stake in the venture. Founded in 2016, FlippAR lets users see information about buildings, monuments, and statues by scanning them through its app. ","http://images.newsinshorts.com.edgesuite.net/app_assets/images/2017/21sep/inshorts_image_1505976339134_590.jpg?resize=400px:*","https://www.vccircle.com/exclusive-chris-gayle-takes-the-crease-for-augmented-reality-startup-flippar/?utm_source=izooto&utm_medium=push_notification&utm_campaign=browser_push&utm_content=&utm_term=&utm_source=inshorts&utm_medium=referral&utm_campaign=fullarticle ","rbu5efup-1"
"800","startup","Waymo seeking $2.6 bn damages from Uber over trade secret","Google spinoff Waymo is seeking about $2.6 billion in damages in a lawsuit against Uber, according to court filings. This compensation is for only one of the nine allegedly stolen secrets and had been redacted from the filings earlier. Waymo had asked the US court to delay the trial, arguing that recently obtained evidence required time to investigate. ","http://images.newsinshorts.com.edgesuite.net/app_assets/images/2017/21sep/inshorts_image_1505977485972_499.jpg?resize=400px:*","https://www.recode.net/2017/9/20/16340046/alphabet-waymo-self-driving-car-uber-stolen-trade-secret-billion-damages-lawsuit-trial-hearing?utm_source=inshorts&utm_medium=referral&utm_campaign=fullarticle ","rbu5efup-1"
"801","startup","Gurugram-based Power2SME raises $36 mn in Series E funding","Gurugram-based Power2SME has raised $36 million in Series E funding round. The round saw participation from existing investors including Inventus Capital Partners, Accel Partners, Kalaari Capital, and Infosys Co-founder Nandan Nilekani. Founded in 2012 by R Narayan, Power2SME directly buys raw materials from suppliers required by SMEs, eliminating the middle-men.","http://images.newsinshorts.com.edgesuite.net/app_assets/images/2017/19sep/inshorts_image_1505816361767_416.jpg?resize=400px:*","https://www.vccircle.com/power2sme-secures-series-e-funding-from-existing-investors/?utm_source=izooto&utm_medium=push_notification&utm_campaign=browser_push&utm_content=&utm_term=&utm_source=inshorts&utm_medium=referral&utm_campaign=fullarticle ","rbu5efup-1"
"802","startup","Noticeboard gets funding from TaxiForSure Co-founder","Bengaluru-based staff communication startup Noticeboard has raised an undisclosed amount of funding from TaxiForSure Co-founder Aprameya Radhakrishna and former Myntra CTO Shamik Sharma. In July, Noticeboard raised $1.2 million in a funding round led by Stellaris Venture Partners. Founded in 2016, the startup aims at facilitating information flow between the employees of a company.","http://images.newsinshorts.com.edgesuite.net/app_assets/images/2017/22sep/inshorts_image_1506074723399_667.jpg?resize=400px:*","https://inc42.com/buzz/noticeboard-shamik-sharma-myntra/?utm_source=inshorts&utm_medium=referral&utm_campaign=fullarticle ","rbu5efup-1"
"803","startup","Musk shares video showing SpaceX's failed rocket landings","SpaceX Founder Elon Musk on Thursday shared a video showing SpaceX's failed rocket landings over the years. Titled 'How Not to Land an Orbital Rocket Booster', the video also gives reason of each failed landing. Musk captioned the video, ""The sordid history of how the @SpaceX Falcon 9... eventually managed to land in one piece and stay that way"".","http://images.newsinshorts.com.edgesuite.net/app_assets/images/2017/15sep/inshorts_image_1505472531640_837.jpg?resize=400px:*","https://www.instagram.com/p/BZA0s7EAmF1/?hl=en&taken-by=elonmusk&utm_source=inshorts&utm_medium=referral&utm_campaign=fullarticle ","jexwopje-1"
"804","startup","Startups can do what IT did in late 1990s: Rishad Premji","Rishad Premji, Wipro's Chief Strategy Officer, said that startups can do for India what IT services did in late 1990s. He said the startup ecosystem can be a huge employment creator, huge wealth generator, and a huge brand builder for India. He further said the current discourse on death of India's $154 billion (₹9.87 lakh crore) IT industry is overstated.","http://images.newsinshorts.com.edgesuite.net/app_assets/images/2017/15sep/inshorts_image_1505471601715_206.jpg?resize=400px:*","http://www.livemint.com/Companies/UijX0qmHBPdbi9a7OLGfOM/Wipros-Rishad-Premji-Startups-can-do-for-India-what-IT-di.html?utm_source=inshorts&utm_medium=referral&utm_campaign=fullarticle ","jexwopje-1"
"805","startup","Uber India apologises for 'sexist' message to users","Ride-hailing startup Uber on Sunday apologised for sending its users a 'sexist' promotional message in Bengaluru. ""Dear Husbands, a gentle reminder - Today is Wife Appreciation Day! Order on UberEATS and let your wife take a day off from the kitchen,"" the message read. Uber later tweeted that the message had been ""totally inappropriate"".","http://images.newsinshorts.com.edgesuite.net/app_assets/images/2017/18sep/inshorts_image_1505750087528_476.jpg?resize=400px:*","http://fortune.com/2017/09/18/uber-eats-promo-sexism-wife-day/?utm_source=inshorts&utm_medium=referral&utm_campaign=fullarticle ","jexwopje-1"
"806","startup"," ₹1,15,000 smart helmet with rearview camera made ","Japan-based startup Borderless has created a  ₹1,15,000 smart helmet with an inbuilt rearview camera to give users a 360° visibility while riding a motorbike. The helmet which connects to an app also allows users to send information like navigation, time, and distance to the destination, from their smartphone. The information is then displayed on a head-up screen of the helmet. ","http://images.newsinshorts.com.edgesuite.net/app_assets/images/2017/18sep/inshorts_image_1505729990521_528.jpg?resize=400px:*","https://www.kickstarter.com/projects/491835187/crosshelmet-the-smart-motorcycle-helmet?ref=category_popular&utm_source=inshorts&utm_medium=referral&utm_campaign=fullarticle ","jexwopje-1"
"807","startup","Snapdeal spending $500mn to be like us: ShopClues Co-founder","ShopClues Co-founder Radhika Aggarwal in an interview said Snapdeal spent over $2 billion trying to be Flipkart and is now spending half a billion dollars ($500 million) trying to be like ShopClues. Aggarwal added, ""If it was so easy to become ShopClues everyone else would have done it as well."" This comes after Snapdeal discontinued merger talks with Flipkart.","http://images.newsinshorts.com.edgesuite.net/app_assets/images/2017/15sep/inshorts_image_1505482405803_284.jpg?resize=400px:*","https://officechai.com/startups/snapdeal-spent-2-billion-trying-flipkart-now-theyre-spending-500-million-us-shopclues-2/?utm_source=inshorts&utm_medium=referral&utm_campaign=fullarticle#sthash.tWEJulLA.dpbs ","jexwopje-1"
"808","startup","Bengaluru startup delivers dairy, poultry products via app","Bengaluru-based startup Doodhwala delivers dairy and poultry products to consumers' doorstep via its app. The app also allows users to filter products based on their lifestyle, health condition, and preferences. Founded in 2015 by Manipal Institute of Technology alumni Aakash Agrawal and Ebrahim Akbari, the startup offers over 70 varieties of milk and currently operates in Pune and Bengaluru.","http://images.newsinshorts.com.edgesuite.net/app_assets/images/2017/18sep/inshorts_image_1505719238210_528.jpg?resize=400px:*","https://yourstory.com/2017/09/app-based-milkman-doodhwala-digitising-milk-delivery/?utm_source=inshorts&utm_medium=referral&utm_campaign=fullarticle ","jexwopje-1"
"809","startup","Uber sues advertisement agency for fake ads","Cab-hailing startup Uber has filed a lawsuit in the US against advertising agency Fetch Media for improperly billing Uber for ""fake"" online advertisements. Uber discovered its advertisements on a website even after it asked Fetch to not post them. Uber, which reportedly plans to seek $40 million in damages, alleged Fetch ""fraudulently"" claimed credit for app downloads it didn't generate.","http://images.newsinshorts.com.edgesuite.net/app_assets/images/2017/19sep/inshorts_image_1505803517610_976.jpg?resize=400px:*","https://www.bloomberg.com/news/articles/2017-09-18/uber-goes-on-rare-legal-offensive-suing-dentsu-unit-for-fraud?utm_source=inshorts&utm_medium=referral&utm_campaign=fullarticle ","jexwopje-1"
"810","startup","It’s not about spreading dollar bills: SoftBank MD","SoftBank Managing Director Deep Nishar, on company's investments in various ride-hailing startups, has said, ""it's not about taking a bunch of dollar bills and spreading them around."" Speaking at Harvard Business School, Nishar added SoftBank's approach isn't to ""bet on every odd number on the roulette table"". Reportedly, SoftBank is close to finalising its investment in cab-hailing startup Uber.","http://images.newsinshorts.com.edgesuite.net/app_assets/images/2017/17sep/inshorts_image_1505637789229_986.jpg?resize=400px:*","https://www.recode.net/2017/9/16/16319158/softbank-uber-lyft-ride-sharing-united-states?utm_source=inshorts&utm_medium=referral&utm_campaign=fullarticle ","jexwopje-1"
"811","startup","Zomato valued at $1.4 billion by Nomura","Japanese financial services company Nomura's India arm has valued the food discovery and ordering startup Zomato at $1.4 billion. The valuation comes after reports said Zomato may raise up to $200 million from Alibaba's payments firm Ant Financial. Nomura estimated Zomato's sales could reach $300 million over five years to the fiscal year 2022.","http://images.newsinshorts.com.edgesuite.net/app_assets/images/2017/16sep/inshorts_image_1505555136346_496.jpg?resize=400px:*","http://www.livemint.com/Companies/Oa9EEL8OpufrTIyVV21JxO/Zomato-valued-at-14-billion-by-Nomura.html?utm_source=inshorts&utm_medium=referral&utm_campaign=fullarticle ","jexwopje-1"
"812","startup","Indian startup wins ₹27 lakh contest for modular greenhouse","Hyderabad-based startup Kheyti has won an award in Israel for developing a modular greenhouse. The startup which won a cash prize of over ₹27 lakh, was chosen as the winner amongst ten finalists in the MassChallenge Israel contest, which saw participation from over 500 companies. Kheyti developed a modular greenhouse that claims to help small farmers increase their farm yield. ","http://images.newsinshorts.com.edgesuite.net/app_assets/images/2017/17sep/inshorts_image_1505643699630_126.jpg?resize=400px:*","http://indiatoday.intoday.in/story/indian-start-up-wins-prestigious-award-in-israel/1/1049863.html?utm_source=inshorts&utm_medium=referral&utm_campaign=fullarticle ","jexwopje-1"
"813","startup","Policy to deal with government is to fall in love: Jack Ma","\nChina-based e-commerce giant Alibaba's Founder Jack Ma has said that his policy for dealing with the government is to fall in love, but not to marry. In a recent interview, he also said, ""We have had terrible experiences, but we've learned how to work with regulators."" He added it is always painful to enter new fields without clear regulations.","http://images.newsinshorts.com.edgesuite.net/app_assets/images/2017/16sep/inshorts_image_1505563337605_700.jpg?resize=400px:*","https://www.bloomberg.com/news/articles/2017-09-14/jack-ma-says-alibaba-has-to-change-mindset-for-global-expansion?utm_source=inshorts&utm_medium=referral&utm_campaign=fullarticle ","jexwopje-1"
"814","startup","4,200 startups registered with Karnataka govt: IT Minister","Karnataka IT Minister Priyank Kharge recently said nearly 60% or 4,200 out of about 7,200 startups in the country have registered with the state's Startup Cell. Speaking at a meet attended by startups and enterprises, Kharge hailed Karnataka as the first Indian state to have a startup policy. He added that Karnataka government was introducing new programmes to encourage startups.","http://images.newsinshorts.com.edgesuite.net/app_assets/images/2017/19sep/inshorts_image_1505799249233_607.jpg?resize=400px:*","http://www.newindianexpress.com/cities/bengaluru/2017/sep/19/42k-start-ups-registered-priyank-kharge-1659389.html?utm_source=inshorts&utm_medium=referral&utm_campaign=fullarticle ","jexwopje-1"
"815","startup","Profitability not the highest priority: Flipkart CEO ","Flipkart's CEO Kalyan Krishnamurthy in an interview this week said, ""Profitability is not the highest priority today"" for the homegrown e-commerce startup. He added that Flipkart wants ""to bring as many people as possible into the e-commerce fold"". Krishnamurthy further said the startup whose ""large part"" of business comes from mobile phones, is ""comfortable on the burn"" it currently has.","http://images.newsinshorts.com.edgesuite.net/app_assets/images/2017/19sep/inshorts_image_1505805411952_103.jpg?resize=400px:*","http://www.livemint.com/Companies/QQxY5zwqM1WlxQP43cmjON/Profitability-not-the-highest-priority-today-says-Flipkart.html?utm_source=inshorts&utm_medium=referral&utm_campaign=fullarticle ","jexwopje-1"
"816","startup","Nobody is an expert: Alibaba's Jack Ma on globalisation","China-based e-commerce giant Alibaba's Founder Jack Ma in a recent interview compared Tencent and Amazon's globalisation plans with Alibaba's and said, ""nobody is an expert"". He added, ""We are new. The competition that you should worry about is going to be in local areas."" He further said Alibaba going outside China is not about globalising Alibaba, but globalising e-commerce infrastructure.","http://images.newsinshorts.com.edgesuite.net/app_assets/images/2017/17sep/inshorts_image_1505630483209_556.jpg?resize=400px:*","https://www.bloomberg.com/news/articles/2017-09-14/jack-ma-says-alibaba-has-to-change-mindset-for-global-expansion?utm_source=inshorts&utm_medium=referral&utm_campaign=fullarticle ","jexwopje-1"
"817","startup","Slack raises $250 million from SoftBank, others","Messaging startup Slack on Sunday said that it has raised about $250 million in a funding round led by SoftBank's Vision Fund. Accel, a Silicon Valley venture firm, also participated in the round along with other investors, valuing the startup at more than $5 billion. Last year, Slack raised $200 million in Series F funding round.","http://images.newsinshorts.com.edgesuite.net/app_assets/images/2017/18sep/inshorts_image_1505717360674_620.jpg?resize=400px:*","https://www.bloomberg.com/news/articles/2017-09-17/slack-gets-slice-of-softbank-s-100-billion-tech-bounty?utm_source=inshorts&utm_medium=referral&utm_campaign=fullarticle ","jexwopje-1"
"818","startup","Flipkart's wholesale arm raises ₹1,000 crore loan","Online e-commerce giant Flipkart's wholesale arm has raised a ₹1,000 crore loan from Axis Bank, according to documents filed with the Ministry of Corporate Affairs. The raised amount comes in addition to the existing loan of ₹375 crore which was raised in August from the same bank. Flipkart also raised an ₹820 crore loan from Kotak Mahindra Bank in 2015.","http://images.newsinshorts.com.edgesuite.net/app_assets/images/2017/18sep/inshorts_image_1505737990842_327.jpg?resize=400px:*","https://www.vccircle.com/exclusive-ahead-of-sale-season-flipkarts-b2b-arm-raises-156-mn-loan/?utm_source=izooto&utm_medium=push_notification&utm_campaign=browser_push&utm_content=&utm_term=&utm_source=inshorts&utm_medium=referral&utm_campaign=fullarticle ","jexwopje-1"
