"ind","catg","headline","body","imageurl","readmoreurl","inblockId"
"548","startup","Uber faces lawsuit over unequal pay in US","Cab-hailing startup Uber has been sued over unequal pay in the US by two of its former female employees and a currently employed female software engineer. The lawsuit claims Uber's compensation and other practices discriminate against women and people of colour. The lawsuit also claims that Uber's employee ranking system favours men and white or Asian employees.","http://images.newsinshorts.com.edgesuite.net/app_assets/images/2017/26oct/inshorts_image_1509007059910_436.jpg?resize=400px:*","http://in.reuters.com/article/uber-lawsuit/three-women-sue-uber-in-san-francisco-claiming-unequal-pay-benefits-idINKBN1CV099?utm_source=inshorts&utm_medium=referral&utm_campaign=fullarticle ","prfrj7mk-1"
"549","startup","eBay acquires 5.4% stake in Flipkart","E-commerce major eBay has acquired a 5.4% stake in Flipkart, according to the company's quarterly report filed with the US Securities and Exchange (SEC). The acquisition follows the sale of eBay India business to Flipkart for $211 million, which was completed in August. Earlier this year, eBay also invested $500 million into the Indian e-commerce startup.","http://images.newsinshorts.com.edgesuite.net/app_assets/images/2017/26oct/inshorts_image_1509014421442_977.jpg?resize=400px:*","https://inc42.com/buzz/ecommerce-ebay-flipkart-stake/?utm_source=wigzo&utm_medium=wigzopush&utm_campaign=push&utm_term=push&utm_w=25879&utm_source=inshorts&utm_medium=referral&utm_campaign=fullarticle ","prfrj7mk-1"
"550","startup","Tesla lays off employees from solar panel-making business","Tesla has reportedly laid off hundreds of employees from its solar panel-making business SolarCity, citing the terminations are a part of its performance review process. However, a few employees claimed Tesla hasn't conducted the reviews since it acquired SolarCity last year. Earlier, Tesla announced plans to fire 205 SolarCity employees at its Roseville, California office by the end of October. ","http://images.newsinshorts.com.edgesuite.net/app_assets/images/2017/27oct/inshorts_image_1509090907732_531.jpg?resize=400px:*","https://www.theverge.com/2017/10/25/16545956/tesla-solarcity-layoff-firing-elon-musk?utm_source=inshorts&utm_medium=referral&utm_campaign=fullarticle ","prfrj7mk-1"
"551","startup","GoJavas promoter files complaint against Snapdeal Founders","Anand Rai, the promoter of QuickDel Logistics, which owns logistics startup GoJavas has filed a complaint against Snapdeal Co-founders Kunal Bahl and Rohit Bansal, alleging breach of trust. The complaint alleged that Bahl and Bansal stole confidential information including employee data. Earlier this month, GoJavas sent a $45.8 million legal notice to Snapdeal, over similar accusations.","http://images.newsinshorts.com.edgesuite.net/app_assets/images/2017/26oct/inshorts_image_1509020479307_465.jpg?resize=400px:*","https://inc42.com/buzz/snapdeal-founders-gojavas-vulcan-express/?utm_source=inshorts&utm_medium=referral&utm_campaign=fullarticle ","prfrj7mk-1"
"552","startup","Uber launches feature to let users add 3 stops during ride","Cab-hailing startup Uber has launched a new feature that allows users to add up to three stops during a single ride. The users can tap 'Where to?' bar on the top of the screen and can add the addresses of their stops to access the feature. It also lets users add or remove stops in real time.","http://images.newsinshorts.com.edgesuite.net/app_assets/images/2017/27oct/inshorts_image_1509102049848_647.jpg?resize=400px:*","https://www.theverge.com/2017/10/26/16553578/uber-multiple-destination-stops-app-lyft?utm_source=inshorts&utm_medium=referral&utm_campaign=fullarticle ","prfrj7mk-1"
"553","startup","Zenefits fined $1mn for misleading investors","US-based startup Zenefits and its Co-founder Parker Conrad have been fined nearly $1 million by the US Securities and Exchange Commission (SEC). The firm was accused of making ""misleading statements and omissions"" to investors over compliance with state insurance laws. Zenefits and Conrad consented to SEC's order without admitting or denying the findings that they violated federal securities laws.","http://images.newsinshorts.com.edgesuite.net/app_assets/images/2017/27oct/inshorts_image_1509091202476_729.jpg?resize=400px:*","https://techcrunch.com/2017/10/26/sec-fines-zenefits-nearly-1-million-for-misleading-investors/?utm_source=inshorts&utm_medium=referral&utm_campaign=fullarticle ","prfrj7mk-1"
"554","startup","Ten state-owned oil firms launch ₹320 crore startup fund","Ten state-owned oil firms including Indian Oil and ONGC have unveiled a ₹320 crore fund to support startups in the oil and gas sector for a 3-year period. The companies have partnered with 36 startups and Oil Minister Dharmendra Pradhan said more funds can be provided under this initiative. ""One of these companies can topple our oil companies,"" Pradhan said.","http://images.newsinshorts.com.edgesuite.net/app_assets/images/2017/26oct/inshorts_image_1509007569848_897.jpg?resize=400px:*","http://indiatoday.intoday.in/story/oil-psus-unveil-rs-320-cr-startup-fund/1/1075250.html?utm_source=inshorts&utm_medium=referral&utm_campaign=fullarticle ","prfrj7mk-1"
"555","startup","Uber to charge users extra for longer pickup time in US","Ride-hailing startup Uber has introduced a feature to charge users extra for longer pickup time in the US. Drivers can also apply a 'per-minute' late fee if they have to wait longer than 2 minutes at the pickup point. Uber will also help drivers avoid tolls ""whenever possible"" or incorporate it into the fare, during pickups.","http://images.newsinshorts.com.edgesuite.net/app_assets/images/2017/25oct/inshorts_image_1508916763092_353.jpg?resize=400px:*","https://www.engadget.com/2017/10/24/uber-drivers-can-charge-more-for-longer-pickups/?utm_source=inshorts&utm_medium=referral&utm_campaign=fullarticle ","prfrj7mk-1"
"556","startup","Pharrell Williams invests in UK-based music startup Roli","UK-based music startup Roli on Wednesday announced that musician Pharrell Williams has invested an undisclosed amount in the startup and will become its Chief Creative Officer. Responding to the decision, Williams said that he intends to help design instruments and democratise music making. Founded in 2009, Roli has invented musical instruments including the Seaboard, and modular 'Blocks'.","http://images.newsinshorts.com.edgesuite.net/app_assets/images/2017/26oct/inshorts_image_1509006325256_600.jpg?resize=400px:*","https://techcrunch.com/2017/10/25/music-startup-roli-adds-pharrell-williams-as-new-investor-and-chief-creative-officer/?utm_source=inshorts&utm_medium=referral&utm_campaign=fullarticle ","prfrj7mk-1"
"557","startup","Startup raises $5mn for app-controlled debit cards for teens","US-based fintech startup Current has raised $5 million in Series A funding to make debit cards for kids which can be controlled using an app. The round was led by QED Investors and included participation from investment firm Cota Capital. The system offers features like setting spending limits, and blocking certain categories of spending, like plane tickets or casinos. ","http://images.newsinshorts.com.edgesuite.net/app_assets/images/2017/26oct/inshorts_image_1509008770856_802.jpg?resize=400px:*","https://techcrunch.com/2017/10/25/current-raises-5m-for-its-debit-card-for-teens-that-parents-control-with-an-app/?utm_source=inshorts&utm_medium=referral&utm_campaign=fullarticle ","prfrj7mk-1"
"558","startup","Tea infuser startup Teforia shuts down","US-based tea infusion device-making startup Teforia has announced it is shutting down, citing that it failed to raise funds. The startup's flagship product was an internet-connected tea infuser that could brew pre-packaged teas and was priced at about $1,000 (₹64,885). Teforia is offering the tea infuser at a discounted price of $199 (₹12,912) in order to clear inventory.","http://images.newsinshorts.com.edgesuite.net/app_assets/images/2017/28oct/inshorts_image_1509177387425_397.jpg?resize=400px:*","https://techcrunch.com/2017/10/27/1000-tea-infuser-startup-teforia-shuts-down/?utm_source=inshorts&utm_medium=referral&utm_campaign=fullarticle ","prfrj7mk-1"
"559","startup","Edtech startup Brainly raises $14 million in Series B","Polish edtech startup Brainly has raised $14 million in a Series B funding round led by investment company Kulczyk Investments. Investors Runa Capital, Naspers, Point Nine Capital, General Catalyst also participated in the round. Founded in 2009, the startup offers a platform for its users to ask and answer homework questions. ","http://images.newsinshorts.com.edgesuite.net/app_assets/images/2017/26oct/inshorts_image_1509013816742_303.jpg?resize=400px:*","https://techcrunch.com/2017/10/25/brainly-raises-14-million-for-its-quora-for-kids-education-tech/?utm_source=inshorts&utm_medium=referral&utm_campaign=fullarticle ","prfrj7mk-1"
"560","startup","Uber introduces credit card to give reward points in US","Ride-hailing startup Uber is introducing its own credit card called 'Uber Visa' in the US to give reward points to the users. The Uber Visa has no annual fee and users can earn $100 (₹6,500) after spending $500 (₹32,300) within the first 90 days. Users will be able to redeem the points on rides, UberEats delivery and cash back. ","http://images.newsinshorts.com.edgesuite.net/app_assets/images/2017/26oct/inshorts_image_1509000883817_566.jpg?resize=400px:*","https://www.engadget.com/2017/10/25/uber-wants-you-to-trust-it-with-info-on-what-you-purchase/?utm_source=inshorts&utm_medium=referral&utm_campaign=fullarticle ","prfrj7mk-1"
"561","startup","Amazon may bring audible playback to cheapest Kindle","E-commerce giant Amazon may bring audible playback of text to its cheapest Kindle model, according to reports. The feature will reportedly be made available via an over-the-air update. However, users will have to pair it with their own headphones or speakers as the device does not come equipped with speakers, the reports added.","http://images.newsinshorts.com.edgesuite.net/app_assets/images/2017/29oct/inshorts_image_1509266386676_767.jpg?resize=400px:*","https://www.theverge.com/2017/10/28/16564802/amazon-audible-support-kindle?utm_source=inshorts&utm_medium=referral&utm_campaign=fullarticle ","prfrj7mk-1"
"562","startup","Lighting panels to let users change colour via app made","Canadian smart-lighting startup Nanoleaf Aurora has developed triangle-shaped LED lighting panels that let users change its colour through an app. An add-on module called 'Rhythm', which plays music can also be attached to the panels to move the light in sync with the music. The panels which can be interlocked also allow users to control the brightness of the light.","http://images.newsinshorts.com.edgesuite.net/app_assets/images/2017/24oct/inshorts_image_1508846535195_743.jpg?resize=400px:*","http://mashable.com/2017/10/23/smart-at-home-lighting-system-with-led-panels/?utm_cid=hp-r-1&utm_source=inshorts&utm_medium=referral&utm_campaign=fullarticle#Y96TTbtwtkq2 ","mmchkhv9-1"
"563","startup","Tesla signs deal to set up manufacturing factory in China","Electric carmaker Tesla has reportedly signed a deal with the Shanghai government to set up its own manufacturing facility in the city's free-trade zone in China. The agreement could enable Tesla to slash production costs, while incurring China's 25% import tariff. The electric carmaker intends to ""clearly define"" production plans in China by year's end, a Tesla spokesperson said. ","http://images.newsinshorts.com.edgesuite.net/app_assets/images/2017/22oct/inshorts_image_1508679699095_549.jpg?resize=400px:*","https://www.theverge.com/2017/10/22/16516064/tesla-reached-deal-factory-china-shanghai-electric-vehicles-cars?utm_source=inshorts&utm_medium=referral&utm_campaign=fullarticle ","mmchkhv9-1"
"564","startup","China to get first Tesla factory outside US","Electric carmaker Tesla has reached an agreement with China, instead of India, to set up its first electric car factory outside the US. The announcement came after months of speculations that Tesla would make its cars in India. This deal will allow Tesla to avoid 25% duty China imposes on imported cars and have a larger customer base than India. ","http://images.newsinshorts.com.edgesuite.net/app_assets/images/2017/24oct/inshorts_image_1508829377283_582.jpg?resize=400px:*","http://www.livemint.com/Industry/FzVnKjuv1qd5FxJoFaGtVJ/India-loses-out-to-China-on-first-Tesla-factory-outside-US.html?utm_source=inshorts&utm_medium=referral&utm_campaign=fullarticle ","mmchkhv9-1"
"565","startup","Android Co-founder's Essential cuts phone's price to $499","Android Co-founder Andy Rubin's phone-making startup Essential has cut the price of its smartphone from $699 to $499. In addition to it, Essential announced, the people who bought the phone prior to its price drop can avail a $200 'friends & family' code. The code can be used to purchase an Essential Phone or Essential 360 Camera, the company added.","http://images.newsinshorts.com.edgesuite.net/app_assets/images/2017/23oct/inshorts_image_1508742094574_346.jpg?resize=400px:*","https://www.engadget.com/2017/10/22/essential-cuts-the-price-of-its-phone-to-499/?utm_source=inshorts&utm_medium=referral&utm_campaign=fullarticle ","mmchkhv9-1"
"566","startup","Robert Scoble quits his AR startup amid harassment scandal","Technology blogger Robert Scoble has resigned from his AR startup Transformation Group amid allegations of sexual harassment by three women. Scoble was accused by journalist Quinn Norton, ProDay Founder Sarah Kunst and former colleague Michelle Greer of sexual and verbal harassment. His departure was announced in a Facebook post on Sunday by Shel Israel, a partner at Transformation Group. ","http://images.newsinshorts.com.edgesuite.net/app_assets/images/2017/24oct/inshorts_image_1508831686663_262.jpg?resize=400px:*","https://www.theverge.com/2017/10/23/16527862/robert-scoble-resigns-transformation-group-sexual-harassment?utm_source=inshorts&utm_medium=referral&utm_campaign=fullarticle ","mmchkhv9-1"
"567","startup","Startup raises $8.5 mn to use credit cards as debit cards","US-based banking startup Zero which plans to launch credit cards to be used as debit cards also, has raised $8.5 million in a funding round led by ENIAC Ventures. The round also saw participation from investors including venture capital firm NEA, Lightbank and others. The startup also offers an app that updates in real-time with deposits, purchases, and transfers. ","http://images.newsinshorts.com.edgesuite.net/app_assets/images/2017/23oct/inshorts_image_1508763449900_628.jpg?resize=400px:*","https://techcrunch.com/2017/10/23/zero-raises-8-5-million-for-a-credit-card-that-functions-like-a-debit-card/?utm_source=inshorts&utm_medium=referral&utm_campaign=fullarticle ","mmchkhv9-1"
"568","startup","Female Uber driver shot after picking up two riders in US","A female Uber driver was shot in the neck shortly after picking up two passengers at the San Francisco International airport, earlier this week. She was driving along the freeway when gunshots were fired, according to the California Highway Patrol (CHP). However, CHP Officer Vu Williams said that the motive for the shooting has not been determined.","http://images.newsinshorts.com.edgesuite.net/app_assets/images/2017/25oct/inshorts_image_1508928933152_830.jpg?resize=400px:*","http://www.dailymail.co.uk/news/article-5012883/Female-Uber-driver-shot-picking-two-passengers.html?utm_source=inshorts&utm_medium=referral&utm_campaign=fullarticle ","mmchkhv9-1"
"569","startup","Juice startup RAW Pressery raises $6 mn in Series C funding","Mumbai-based juice startup RAW Pressery has raised $6 million (about ₹40 crore) in a Series C funding round led by existing investors Sequoia Capital, Saama Capital and DSG Consumer Partners. The startup plans to use the funds to expand its manufacturing capacity and distribution for new product launches. Founded in 2013, the startup manufactures organic cold-pressed juices and other beverages. ","http://images.newsinshorts.com.edgesuite.net/app_assets/images/2017/24oct/inshorts_image_1508843331996_919.jpg?resize=400px:*","http://www.livemint.com/Companies/LEi4LS6S3OcKnGPLeod1XJ/RAW-Pressery-gets-6-million-funding-from-Sequoia-Saama-Cap.html?utm_source=inshorts&utm_medium=referral&utm_campaign=fullarticle ","mmchkhv9-1"
"570","startup","Food waste measuring startup Winnow raises $7.4 million","UK-based food waste measuring startup Winnow has raised $7.4 million (₹48 crore) in a funding round co-led by Circularity Capital. The round also saw participation from existing backers like Mustard Seed, and Sweden-based D-Ax. Founded in 2013, the startup provides systems to help food service companies and restaurants to measure and reduce food waste produced in the kitchens. ","http://images.newsinshorts.com.edgesuite.net/app_assets/images/2017/23oct/inshorts_image_1508742567852_511.jpg?resize=400px:*","https://techcrunch.com/2017/10/22/winnow-raises-further-7-4m/?utm_source=inshorts&utm_medium=referral&utm_campaign=fullarticle ","mmchkhv9-1"
"571","startup","Only 2% of equity funding in 2017 went to women-led startups","Only 2% of all equity funding by startups in 2017 went to those with a woman founder, according to a report by YourStory. It accounts for only $242.7 million of the $12 billion risk capital raised by the private companies. Notably, 9.2% of the funding went to women-led startups in 2016, and the number was at least 6% in 2015.","http://images.newsinshorts.com.edgesuite.net/app_assets/images/2017/24oct/inshorts_image_1508836777383_222.jpg?resize=400px:*","https://yourstory.com/2017/10/women-founders-startup-funding-2017/?utm_source=inshorts&utm_medium=referral&utm_campaign=fullarticle ","mmchkhv9-1"
"572","startup","Two Australian Co-founders get $700 million richer in 24 hrs","Australia's Mike Cannon-Brookes and Scott Farquhar, the Co-founders of enterprise software firm Atlassian, added about $700 million each to their wealth in 24 hours. Their firm posted a revenue growth of 42% in the first quarter following which its shares surged 25% on Friday, boosting the co-founders' wealth. They are now worth an estimated $3.5 billion each, according to Forbes.","http://images.newsinshorts.com.edgesuite.net/app_assets/images/2017/23oct/inshorts_image_1508751451152_139.jpg?resize=400px:*","https://www.forbes.com/sites/noahkirsch/2017/10/21/atlassian-australian-billionaire-founders-700-million-richer-in-24-hours/?utm_source=inshorts&utm_medium=referral&utm_campaign=fullarticle#3fd2d0047b87 ","mmchkhv9-1"
"573","startup","Don't think Uber could offer enough money to return: Fowler","When asked if she would return to Uber, Susan Fowler, whose blog post prompted the ouster of CEO Travis Kalanick, has said, ""I don't think they could offer me enough money to go there."" The former Uber employee had written about the sexism and sexual harassment at Uber. Reports said Fowler is developing a movie about her experiences at Uber.","http://images.newsinshorts.com.edgesuite.net/app_assets/images/2017/22oct/inshorts_image_1508666534906_364.jpg?resize=400px:*","http://mashable.com/2017/10/21/uber-susan-fowler-interview-nyt/?utm_cid=hp-r-2&utm_source=inshorts&utm_medium=referral&utm_campaign=fullarticle#YCEwegk6IsqU ","mmchkhv9-1"
"574","startup","Flipkart in talks to invest in Swiggy, Urban Ladder: Reports","E-commerce giant Flipkart is in talks to invest in Bengaluru-based food delivery startup Swiggy and online furniture startup Urban Ladder, according to reports. Flipkart has also held investment talks with home services startup UrbanClap, reports added. Last week, reports suggested that Flipkart was in preliminary talks to buy a minority stake in the ticketing platform, BookMyShow. ","http://images.newsinshorts.com.edgesuite.net/app_assets/images/2017/23oct/inshorts_image_1508754332710_567.jpg?resize=400px:*","http://www.bgr.in/news/flipkart-in-talks-to-invest-in-swiggy-urbanladder-urbanclap-and-others-report/?utm_source=inshorts&utm_medium=referral&utm_campaign=fullarticle ","mmchkhv9-1"
"575","startup","Only one of top 18 executives at Amazon is female","According to employees at Amazon, Senior Vice President of Human Resources Beth Galetti is the only woman among the company's top 18 executives. The executive team of which Galetti is a part is called 'S-team' and reports directly to the company's CEO. Also, 61% of its work force and 75% of its managers are men, according to Amazon's diversity report.","http://images.newsinshorts.com.edgesuite.net/app_assets/images/2017/23oct/inshorts_image_1508747315699_700.jpg?resize=400px:*","https://www.recode.net/2017/10/21/16512448/amazon-gender-diversity-leadership-executives-jeff-bezos?utm_source=inshorts&utm_medium=referral&utm_campaign=fullarticle ","mmchkhv9-1"
"576","startup","Will take legal action against Unicommerce: Paytm Mall COO","Paytm's e-commerce unit, Paytm Mall's Chief Operating Officer (COO) Amit Sinha has said that it will take legal action against Snapdeal's Unicommerce for data misuse. It comes after Unicommerce said that Paytm had withdrawn the case after failing to prove its allegations. Paytm also warned sellers transacting on its platform not to use Unicommerce, in a company's blog post. ","http://images.newsinshorts.com.edgesuite.net/app_assets/images/2017/24oct/inshorts_image_1508841658448_850.jpg?resize=400px:*","http://www.thenewsminute.com/article/paytm-mall-take-legal-action-snapdeal-s-unicommerce-alleged-misuse-data-70491?utm_source=inshorts&utm_medium=referral&utm_campaign=fullarticle ","mmchkhv9-1"
"577","startup","Canada bans Silicon Valley's meal replacement drink Soylent","Canada has banned the Silicon Valley's 'meal-replacement' drink called Soylent, according to a blog post by Rosa Labs which produces the product. The post states that the Canadian Food Inspection Agency has declared that their product didn't meet standards for a meal replacement. It also mentioned that the startup will work with Canada's food regulator to allow Soylent sales. ","http://images.newsinshorts.com.edgesuite.net/app_assets/images/2017/25oct/inshorts_image_1508921465009_287.jpg?resize=400px:*","http://mashable.com/2017/10/24/canada-soylent-banned/?utm_cid=hp-hh-sec&utm_source=inshorts&utm_medium=referral&utm_campaign=fullarticle#Aqnui2tpkgqP ","mmchkhv9-1"
"578","startup","Former Flipkart COO Nitin Seth joins Incedo as its CEO","Nitin Seth, former Chief Operating Officer (COO) of homegrown e-commerce startup Flipkart has joined US-based technology services firm Incedo. He previously served Fidelity International as its Managing Director and Country Head for India. Seth will follow Incedo's Co-founder Tejinderpal Miglani to take over the CEO role, Incedo said in a blog post.","http://images.newsinshorts.com.edgesuite.net/app_assets/images/2017/23oct/inshorts_image_1508766406307_952.jpg?resize=400px:*","https://www.incedoinc.com/newsevents/nitin_seth_former_fidelity_mckinsey_senior_executive_to_lead_incedo_as_chief_executive_officer?utm_source=inshorts&utm_medium=referral&utm_campaign=fullarticle#events ","mmchkhv9-1"
"579","startup","FreeCharge's Kunal Shah calls Anant Ambani 'biggest loser'","FreeCharge Founder Kunal Shah shared a picture with Mukesh Ambani's son, Anant Ambani, calling him ""the biggest loser"" in terms of weight loss. Shah captioned the photo saying, ""139 kgs lost. 4 hours workout everyday. Enjoying protein shakes at a party."" A user reacted to the post saying, ""Haar ke jeetne wale ko Ambani kehte hai.""","http://images.newsinshorts.com.edgesuite.net/app_assets/images/2017/23oct/inshorts_image_1508751166600_488.jpg?resize=400px:*","https://www.facebook.com/photo.php?fbid=10214478902744272&set=a.3370241132747.2159747.1170805985&type=3&theater&utm_source=inshorts&utm_medium=referral&utm_campaign=fullarticle ","mmchkhv9-1"
"580","startup","E-learning startup Toppr raises $7 million in Series B","Mumbai-headquartered e-learning startup Toppr has raised nearly $7 million in Series B funding round from investors including SAIF Partners. Toppr has reportedly been valued at $65 million post the investment in which existing investors Helion Ventures also participated. Founded in 2013 by Zishaan Hayath and Hemanth Goteti, Toppr provides tailored content for competitive exam preparation.","http://images.newsinshorts.com.edgesuite.net/app_assets/images/2017/24oct/inshorts_image_1508832995910_289.jpg?resize=400px:*","https://inc42.com/buzz/elearning-toppr-funding/?utm_source=inshorts&utm_medium=referral&utm_campaign=fullarticle ","mmchkhv9-1"
"581","startup","Tech revolution is coming and nobody can stop it: Jack Ma","Chinese e-commerce giant Alibaba's Founder Jack Ma has said that the ""technology revolution is coming, and nobody can stop it."" Speaking at a recent event, Ma also said that if people keep teaching their kids the way they have been for over last 100 years, they will keep ""them from getting jobs over the next 30 years"".","http://images.newsinshorts.com.edgesuite.net/app_assets/images/2017/23oct/inshorts_image_1508738722299_503.jpg?resize=400px:*","https://www.rt.com/business/407286-alibaba-ma-russian-young-scientists/?utm_source=inshorts&utm_medium=referral&utm_campaign=fullarticle ","mmchkhv9-1"
