"ind","catg","headline","body","imageurl","readmoreurl","inblockId"
"1","startup","Startup lets users render themselves inside VR in real time","Switzerland-based virtual reality (VR) startup Imverse has developed a technology which lets users render themselves inside VR in real time. It is able to deliver the sensation of a user's real body existing in virtual reality. It also offers the ability to render other objects, including people, allowing a user in a VR headset shake hands with one who isn't.","http://images.newsinshorts.com.edgesuite.net/app_assets/images/2018/31jan/inshorts_image_1517376037012_942.jpg?resize=400px:*","https://techcrunch.com/2018/01/30/imverse-mixed-reality/?utm_source=inshorts&utm_medium=referral&utm_campaign=fullarticle ","aljwxxg5-2"
"2","startup","Musk's Boring Company sells flamethrowers worth $5 million","Elon Musk's tunnelling startup 'The Boring Company' has sold 10,000 flamethrowers so far, earning around $5 million. The $500 flamethrower, deemed the 'world's safest' by Musk, throws flames shorter than 10 feet, and was unveiled by the startup earlier this week. Notably, The Boring Company has only offered 20,000 flamethrowers for sale.","http://images.newsinshorts.com.edgesuite.net/app_assets/images/2018/30jan/inshorts_image_1517294094641_473.jpg?resize=400px:*","https://twitter.com/elonmusk/status/958081411470131200?utm_source=inshorts&utm_medium=referral&utm_campaign=fullarticle ","aljwxxg5-2"
"3","startup","HR firm in Gurugram uses AI to hire without bias","Gurugram-headquartered HR firm PeopleStrong has launched a product called Alt Recruit which uses artificial intelligence (AI) to suggest candidates for job openings. The firm's CEO Pankaj Bansal said the AI tracks data from the web, and the client's internal database to look for a perfect match without bias. It can also help in negotiating salaries and onboarding and subsequent processes.","http://images.newsinshorts.com.edgesuite.net/app_assets/images/2018/30jan/inshorts_image_1517298618753_912.jpg?resize=400px:*","https://www.vccircle.com/this-hr-firm-is-using-ai-to-hire-without-bias-negotiate-salary/?utm_source=inshorts&utm_medium=referral&utm_campaign=fullarticle ","aljwxxg5-2"
"4","startup","Faraday Future accuses former CFO of stealing trade secrets","Electric carmaker and Tesla rival Faraday Future has accused its former CFO Stefan Krause of stealing trade secrets and attempting to recruit its employees. It has also filed a lawsuit against Krause's electric car startup Evelozcity over trade secrets theft. Interestingly, Krause was fired by Faraday Future last year over dereliction of duty.","http://images.newsinshorts.com.edgesuite.net/app_assets/images/2018/30jan/inshorts_image_1517298667572_114.jpg?resize=400px:*","https://www.engadget.com/2018/01/29/faraday-future-lawsuit-claims-former-exec-stole-trade-secrets/?utm_source=inshorts&utm_medium=referral&utm_campaign=fullarticle ","aljwxxg5-2"
"5","startup"," Indian e-commerce market hits $33 billion: Economic Survey","Indian e-commerce market has reached $33 billion, registering 19.1% growth in 2016-2017, according to the government's Economic Survey 2018. However, the market value is still 30% less than what Chinese e-commerce companies sold on one day on the Singles Day last year. Also, India's Information Technology (IT)/IT-enabled services sector has grown to $140 billion, registering 8% growth.","http://images.newsinshorts.com.edgesuite.net/app_assets/images/2018/30jan/inshorts_image_1517305744510_849.jpg?resize=400px:*","https://inc42.com/buzz/economic-survey-ecommerce-market/?utm_source=inshorts&utm_medium=referral&utm_campaign=fullarticle ","aljwxxg5-2"
"6","startup","Paytm's office boy makes ₹20 lakh after selling his stock","An office boy at digital payment company Paytm has made over ₹20 lakh in the recently conducted stock sale wherein around 200 employees sold their shares worth ₹300 crore. The stock sale also saw some 20-25 employees make ₹6-7 crore each (around $1 million). The sale made Paytm second-most valuable internet startup in India with a valuation of $10 billion.","http://images.newsinshorts.com.edgesuite.net/app_assets/images/2018/30jan/inshorts_image_1517288985256_762.jpg?resize=400px:*","https://www.hindustantimes.com/business-news/paytm-employees-make-big-bucks-after-share-sale-20-turn-millionaires/story-213zJDoPtCQnLvfj5hbXQO.html?utm_source=inshorts&utm_medium=referral&utm_campaign=fullarticle ","aljwxxg5-2"
"7","startup","Mukesh Bansal's healthcare startup Cure.Fit raises $10 mn","Myntra Co-founder Mukesh Bansal's healthcare startup Cure.Fit has raised $10 million in debt financing from HDFC Bank and Axis Bank. The fundraise is a part of an earlier round, where the startup raised $3.2 million from investors including Trifecta Capital. Founded in 2016, the Bengaluru-based startup offers both digital and offline experiences across fitness, nutrition and mental wellbeing.","http://images.newsinshorts.com.edgesuite.net/app_assets/images/2018/30jan/inshorts_image_1517327180894_270.jpg?resize=400px:*","https://inc42.com/buzz/curefit-debt-fitness/?utm_source=inshorts&utm_medium=referral&utm_campaign=fullarticle ","aljwxxg5-2"
"8","startup","Google confirms investment in Uber's Indonesia rival Go-Jek","Google has confirmed it invested in cab aggregator Go-Jek, Uber's rival in Indonesia. The investment, made alongside Singapore-based venture fund Temasek and China's Meituan-Dianping, marks the first direct investment from the US tech giant in Indonesia. Founded in 2010, Go-Jek offers motorbikes and taxis on demand, along with services like grocery delivery and mobile payments.","http://images.newsinshorts.com.edgesuite.net/app_assets/images/2018/29jan/inshorts_image_1517214844571_284.jpg?resize=400px:*","https://techcrunch.com/2018/01/28/google-confirms-go-jek-investment/?utm_source=inshorts&utm_medium=referral&utm_campaign=fullarticle ","aljwxxg5-2"
"9","startup","Alibaba, Foxconn lead $350mn funding in electric car startup","China's Alibaba and Foxconn Technology have led a $347.74 million funding round in Chinese electric car maker Xiaopeng Motors. Other investors in the round include IDG Capital and previous investors GGV Capital, Morningside Venture Capital and Matrix Partners. The latest investment brings the startup's total funding to $790 million, it said in a statement.","http://images.newsinshorts.com.edgesuite.net/app_assets/images/2018/29jan/inshorts_image_1517229832857_236.jpg?resize=400px:*","https://in.reuters.com/article/china-ev-funding/alibaba-foxconn-lead-350-million-funding-in-electric-car-startup-idINKBN1FI0U8?utm_source=inshorts&utm_medium=referral&utm_campaign=fullarticle ","aljwxxg5-2"
"10","startup","Paytm, Alibaba's AGTech launch gaming platform in India","Paytm and China's Alibaba-owned AGTech Holdings have partnered to launch a gaming platform called Gamepind for users in India. The platform will be available as a standalone app and in the Paytm app, the company said in a statement on Monday. Gamepind will offer popular social, casual and sports games and provide cash coupons and products to users. ","http://images.newsinshorts.com.edgesuite.net/app_assets/images/2018/29jan/inshorts_image_1517227751587_852.jpg?resize=400px:*","http://www.livemint.com/Companies/d0dFl6HlhImQIzhbpSM47K/Paytm-Alibabas-AGTech-Holdings-launch-new-mobile-gaming-pl.html?utm_source=inshorts&utm_medium=referral&utm_campaign=fullarticle ","aljwxxg5-2"
"11","startup","Toilet hygiene startup PeeSafe raises $1 million","Gurugram-based toilet hygiene startup PeeSafe has raised $1 million in a funding round that saw participation from Ola Cabs Vice President Rahul Maroli. Vice President at Star India Shivani Singh and BookMyShow's Head of Finance Mitesh Shah also participated in the funding round. Founded in 2014, PeeSafe offers toilet seat spray that sanitises it to ensure hygiene.","http://images.newsinshorts.com.edgesuite.net/app_assets/images/2018/30jan/inshorts_image_1517308956868_453.jpg?resize=400px:*","https://www.vccircle.com/toilet-hygiene-brand-peesafe-raises-1-mn-2/?utm_source=inshorts&utm_medium=referral&utm_campaign=fullarticle ","aljwxxg5-2"
"12","startup","Sequoia plans its largest-ever fundraising at $8 bn: Reports","US-based venture capital firm Sequoia Capital is aiming to raise up to $8 billion in its largest-ever fundraising, according to reports. For the new global fund, Sequoia is trying to attract investors in China, the reports added. However, the size of the fund could also remain at a lower value of $5-6 billion.","http://images.newsinshorts.com.edgesuite.net/app_assets/images/2018/31jan/inshorts_image_1517391827580_876.jpg?resize=400px:*","https://www.vccircle.com/sequoia-capital-plans-8-bn-global-fund-with-eye-on-diversification/?utm_source=inshorts&utm_medium=referral&utm_campaign=fullarticle ","aljwxxg5-2"
"13","startup","Firm that helps make VR content without coding raises ₹3.1cr","Bengaluru-headquartered virtual reality (VR) startup Scapic, which allows users to create VR and augmented reality content without coding, has raised ₹3.1 crore seed funding. The startup lets users drag and drop graphic interfaces using browser tool to create virtual 'scenes' that can be viewed using VR glasses. It's Co-founder Sai Krishna VK is an alumnus of Stanford and IIM Lucknow. ","http://images.newsinshorts.com.edgesuite.net/app_assets/images/2018/31jan/inshorts_image_1517378137540_498.jpg?resize=400px:*","https://www.vccircle.com/vr-ar-platform-scapic-gets-500k-in-seed-funding-from-axilor-others/?utm_source=inshorts&utm_medium=referral&utm_campaign=fullarticle ","aljwxxg5-2"
"14","startup","US politician seeks ban on sale of Elon Musk's flamethrower","US politician Miguel Santiago has said he intends to seek a ban on the sale of Elon Musk-led Boring Company's flamethrower, at least in California. ""I honestly thought it was a joke when the article was read to me,"" Santiago said. However, Musk confirmed that the device throws flames shorter than 10 feet, which is legal as per ATF Bureau.","http://images.newsinshorts.com.edgesuite.net/app_assets/images/2018/30jan/inshorts_image_1517287325148_321.jpg?resize=400px:*","https://www.theverge.com/2018/1/29/16948090/elon-musk-boring-company-flamethrower-california-sales-ban-miguel-santiago?utm_source=inshorts&utm_medium=referral&utm_campaign=fullarticle ","aljwxxg5-2"
"15","startup","Website testing platform BrowserStack raises $50 million","Mumbai-based web and mobile browser testing platform BrowserStack has raised $50 million (₹318 crore) in a Series A funding round from US-based venture capital (VC) firm Accel Partners. The VC firm also picked a minority equity stake in the startup, the company said. Founded in 2011, the startup enables users to test local servers on the cloud through browsers.","http://images.newsinshorts.com.edgesuite.net/app_assets/images/2018/31jan/inshorts_image_1517368981379_274.jpg?resize=400px:*","https://www.vccircle.com/browserstack-bags-50-mn-in-series-a-round-from-accel-partners/?utm_source=inshorts&utm_medium=referral&utm_campaign=fullarticle ","aljwxxg5-2"
"16","startup","Fashion startup 6Degree raises ₹2.6 crore in pre-Series A","Mumbai-based technology-enabled fashion startup 6Degree has raised about ₹ 2.6 crore in pre-Series A funding from Indian Angel Network and TAN Advisors. Funding will be used to upgrade the technology, the startup said. Founded in 2014 by Nikhil Hegde and Amit Bhardwaj, 6Degree is a talent networking platform and also gives real-time information about users' branding in media.","http://images.newsinshorts.com.edgesuite.net/app_assets/images/2018/31jan/inshorts_image_1517384674297_615.jpg?resize=400px:*","https://www.vccircle.com/fashion-startup-6degree-gets-fresh-funding-from-ian-the-angel-network/?utm_source=inshorts&utm_medium=referral&utm_campaign=fullarticle ","aljwxxg5-2"
"17","startup","SoftBank invests $300 million into dog-walking startup Wag","SoftBank's Vision Fund is investing $300 million in US-based dog-walking startup Wag that connects dog walkers with dog owners via an app. SoftBank's managing partner Jeffrey Housenbold and a senior investor will join Wag's board as part of the deal. Founded in 2014, the startup charges about $20 for a half-hour dog walk in New York, Chicago, Austin, and Seattle.","http://images.newsinshorts.com.edgesuite.net/app_assets/images/2018/31jan/inshorts_image_1517373541841_512.jpg?resize=400px:*","https://www.bloomberg.com/news/articles/2018-01-30/softbank-invests-300-million-into-dog-walking-startup-wag?utm_source=inshorts&utm_medium=referral&utm_campaign=fullarticle ","aljwxxg5-2"
"18","startup","Goldman Sachs invests in pea milk startup Ripple Foods","American finance company Goldman Sachs has participated in a $65 million investment in US-based startup Ripple Foods that makes a milk-like drink from yellow peas. The investment, led by Euclidean Capital, includes funding from Khosla Ventures, Fall Line Capital, and S2G Ventures. This is Ripple's largest capital infusion and brings the three-year-old company's total funding to $110 million.","http://images.newsinshorts.com.edgesuite.net/app_assets/images/2018/30jan/inshorts_image_1517296152388_831.jpg?resize=400px:*","https://www.bloomberg.com/news/articles/2018-01-29/goldman-sachs-invests-in-pea-milk-startup?utm_source=inshorts&utm_medium=referral&utm_campaign=fullarticle ","aljwxxg5-2"
"19","startup","Urban Ladder revenue jumps 70% to ₹95 crore in FY 2017","Bengaluru-based online furniture startup Urban Ladder's revenue has jumped 70% to ₹95 crore in fiscal year 2017, filings have revealed. Its consolidated net loss also narrowed to ₹156 crore from ₹182 crore during the year. The startup also posted ₹42 core in operating revenue, a 22% jump from the previous year.","http://images.newsinshorts.com.edgesuite.net/app_assets/images/2018/30jan/inshorts_image_1517287256730_590.jpg?resize=400px:*","https://www.vccircle.com/urban-ladder-fy17-revenue-jumps-70-loss-narrows/?utm_source=inshorts&utm_medium=referral&utm_campaign=fullarticle ","aljwxxg5-2"
"20","startup","Ola may tie up with Assam government for river taxi service","Homegrown taxi aggregator Ola may sign a memorandum of understanding (MoU) with the Assam government for a river taxi service in the state, according to reports. ""They will conduct experiments to ascertain the water behaviour of Brahmaputra before beginning the service,"" state transport minister Chandra Mohan Patowary said. ""There will also be a night navigation system in place,"" he added. ","http://images.newsinshorts.com.edgesuite.net/app_assets/images/2018/29jan/inshorts_image_1517235185983_249.jpg?resize=400px:*","https://www.vccircle.com/ola-may-tie-up-with-assam-govt-for-river-taxi-service/?utm_source=inshorts&utm_medium=referral&utm_campaign=fullarticle ","aljwxxg5-2"
"21","startup","Walmart planning to buy stake in Flipkart: Report","US-based retail giant Walmart is in advanced talks to buy a significant minority stake in Indian e-commerce giant Flipkart, according to reports. Walmart could buy a 15% to 20% stake in the startup. Walmart CEO Doug McMillon led a delegation that visited Flipkart's Bengaluru office last week and the deal could be finalised by March, reports suggested.","http://images.newsinshorts.com.edgesuite.net/app_assets/images/2018/31jan/inshorts_image_1517382445638_976.jpg?resize=400px:*","https://in.reuters.com/article/flipkart-stake-walmart/walmart-in-talks-to-buy-minority-stake-in-flipkart-report-idINKBN1FJ2YN?utm_source=inshorts&utm_medium=referral&utm_campaign=fullarticle ","aljwxxg5-2"
"22","startup","Oxford University spin-out Bodle raises $8.4 mn in series A ","Oxford University spin-out startup Bodle Technologies has raised $8.4 million in a series A funding round led by UK-based Parkwalk Advisors. The round also saw participation from Woodford Patient Capital Trust, Oxford Sciences Innovation and Oxford Technology Management. Founded in 2015, the startup is developing a new type of 'reflective' display technology that aims to use less power.","http://images.newsinshorts.com.edgesuite.net/app_assets/images/2018/29jan/inshorts_image_1517213745162_693.jpg?resize=400px:*","https://techcrunch.com/2018/01/28/bodle/?utm_source=inshorts&utm_medium=referral&utm_campaign=fullarticle ","aljwxxg5-2"
"23","startup","Healthcare startup eKincare raises $1.5 million in Series A","Hyderabad-based healthcare startup eKincare has raised $1.5 million in Series A funding round, the startup confirmed. Investors including Ventureast, Endiya Partners, Eight Roads, and Touchstone Equities participated in the round. Founded in 2014, the app-based startup eKincare allows users to track their health by consolidating an individual's medical history from various healthcare providers.","http://images.newsinshorts.com.edgesuite.net/app_assets/images/2018/30jan/inshorts_image_1517300845614_657.jpg?resize=400px:*","https://www.vccircle.com/health-tech-startup-ekincare-bags-1-5-mn-in-series-a-round/?utm_source=inshorts&utm_medium=referral&utm_campaign=fullarticle ","aljwxxg5-2"
"24","startup","Wedding planning startup Wedding Brigade raises $1 million","Mumbai-based wedding planning startup The Wedding Brigade has raised $1 million in a pre-series A round of funding led by Blume Ventures. Investors including Czar Capital and Mountain Pine Capital also participated in the round. Founded in 2014, The Wedding Brigade is a planning and shopping portal which allows user to find vendors for catering and decoration for their wedding.","http://images.newsinshorts.com.edgesuite.net/app_assets/images/2018/30jan/inshorts_image_1517288535385_975.jpg?resize=400px:*","https://inc42.com/buzz/wedding-brigade-funding-blume-ventures/?utm_source=inshorts&utm_medium=referral&utm_campaign=fullarticle ","aljwxxg5-2"
"25","startup","2 startups win on spot funding at Ten Minute Million contest","Delhi-headquartered AR startup Adloid and health startup My Clinical Nutrition have won on-the-spot funding in the Ten Minute Million contest 2018. The startups were given 10 minutes to talk about their companies before a panel of investors to get on-the-spot offer. As per the contest, the startups will be sharing 4% equity with investors for maximum prize of ₹16 lakh. ","http://images.newsinshorts.com.edgesuite.net/app_assets/images/2018/29jan/inshorts_image_1517217576523_860.jpg?resize=400px:*","https://inc42.com/buzz/ten-minute-million-startups/?utm_source=inshorts&utm_medium=referral&utm_campaign=fullarticle ","aljwxxg5-2"
"26","startup","Elon Musk's Boring Company unveils ₹31,800 flamethrower","Elon Musk-led tunnelling startup 'The Boring Company' has unveiled a flamethrower for sale, priced at $500 (nearly ₹31,800). Musk claims that the device is the ""world's safest flamethrower"" and throws flames shorter than 10 feet, which is legal as per ATF Bureau. With 20,000 flamethrowers for sale, the company is also offering branded fire extinguisher for $30 (about ₹1,900).","http://images.newsinshorts.com.edgesuite.net/app_assets/images/2018/28jan/inshorts_image_1517130864648_206.jpg?resize=400px:*","https://www.engadget.com/2018/01/27/boring-company-flamethrower/?utm_source=inshorts&utm_medium=referral&utm_campaign=fullarticle ","mpftjaua-1"
"27","startup","Google's $30mn race to Moon ends after 10 yrs without winner","Google-funded $30 million-Lunar XPrize race to the Moon, which began 10 years ago, is set to end as no team will be able to make a launch attempt by the March 31 deadline. The competition was for privately-funded teams to be the first to land a robotic spacecraft on the Moon, travel 500 meters, and transmit data back to Earth.","http://images.newsinshorts.com.edgesuite.net/app_assets/images/2018/25jan/inshorts_image_1516863547415_186.jpg?resize=400px:*","https://techcrunch.com/2018/01/23/googles-lunar-xprize-to-go-unclaimed-as-moonshot-deadline-looms/?utm_source=inshorts&utm_medium=referral&utm_campaign=fullarticle ","mpftjaua-1"
"28","startup","TeamIndus ends ISRO deal after Google scraps $30mn Moon race","Bengaluru-based aerospace startup TeamIndus, one of the five finalists of Google's $30-million race to the Moon, has terminated the launch agreement with ISRO. This came a day after Google called off the contest saying no team will be able to attempt launch by the deadline. TeamIndus' deal termination was reportedly attributed to lack of funds, procuring hardware and management issues.","http://images.newsinshorts.com.edgesuite.net/app_assets/images/2018/25jan/inshorts_image_1516856706708_187.jpg?resize=400px:*","https://www.vccircle.com/team-indus-ends-its-pursuit-of-google-lunar-xprize/?utm_source=inshorts&utm_medium=referral&utm_campaign=fullarticle ","mpftjaua-1"
"29","startup","Elon Musk posts video of himself using the new flamethrower","Billionaire Elon Musk has posted a video on his Instagram account showing him using his tunnelling startup Boring Company's flamethrower. ""I want to be clear that a flamethrower is a super terrible idea. Definitely don't buy one. Unless you like fun,"" Musk's post read. Boring Company unveiled the flamethrower priced at $500 (nearly ₹31,800).","http://images.newsinshorts.com.edgesuite.net/app_assets/images/2018/28jan/inshorts_image_1517134029947_777.jpg?resize=400px:*","https://www.instagram.com/p/BeeYW0NA1HU/?hl=en&taken-by=elonmusk&utm_source=inshorts&utm_medium=referral&utm_campaign=fullarticle ","mpftjaua-1"
"30","startup","Uber CEO Dara Khosrowshahi to visit India next month","Uber's Chief Executive Officer Dara Khosrowshahi is scheduled to visit India next month, a company spokesperson has confirmed. The spokesperson said Asia is an important region for Uber and added that Khosrowshahi will meet high-ranking government officials, regulators, business partners, and the company's employees. Khosrowshahi will also visit Japan during his tour.","http://images.newsinshorts.com.edgesuite.net/app_assets/images/2018/25jan/inshorts_image_1516862673459_341.jpg?resize=400px:*","https://www.vccircle.com/uber-ceo-to-visit-india-next-month-in-quest-to-improve-firms-image/?utm_source=inshorts&utm_medium=referral&utm_campaign=fullarticle ","mpftjaua-1"
"31","startup","Flipkart, Amazon both claim of higher R-Day sales than other","Amazon India has claimed of registering double the orders than Indian e-commerce giant Flipkart during Republic Day sales. Flipkart, however, has denied the claims stating it maintained the lead with over 60% market share. Amazon further boasted of acquiring highest number of new customers in a single event, outside of Diwali sales, with 85% of them from tier II-III cities.","http://images.newsinshorts.com.edgesuite.net/app_assets/images/2018/26jan/inshorts_image_1516955838690_134.jpg?resize=400px:*","https://inc42.com/buzz/amazon-india-flipkart-sale/?utm_source=inshorts&utm_medium=referral&utm_campaign=fullarticle ","mpftjaua-1"
"32","startup","Denied job for not being 'Uber-y enough', claims woman","Uber has been sued by a woman named Ilana Diamond who claims she was rejected for a full-time job because she wasn't ""Uber-y enough"". In the lawsuit claiming gender discrimination, Diamond said she was allegedly replaced as the acting photo brand manager by a man with less experience. She also claims upon confrontation, an Uber supervisor said, ""He's a dude"".","http://images.newsinshorts.com.edgesuite.net/app_assets/images/2018/28jan/inshorts_image_1517137554805_949.jpg?resize=400px:*","https://www.bloomberg.com/news/articles/2018-01-27/to-be-uber-y-enough-for-a-job-you-best-be-a-dude-woman-claims?utm_source=inshorts&utm_medium=referral&utm_campaign=fullarticle ","mpftjaua-1"
"33","startup","Paytm valuation hits $10 bn after 200 employees sell shares","Indian digital payment startup Paytm has crossed $10 billion valuation for the first time after 200 current and former employees sold their shares worth $47.2 million (₹300 crore). Paytm's last valuation stood at $7 billion when it raised $1.4 billion from SoftBank last year. The new valuation makes Paytm second-most valuable internet startup in India after Flipkart (about $12 billion).","http://images.newsinshorts.com.edgesuite.net/app_assets/images/2018/29jan/inshorts_image_1517209644792_142.jpg?resize=400px:*","https://www.indiatoday.in/technology/news/story/paytm-reaches-usd-10-billion-valuation-1156328-2018-01-29?utm_source=inshorts&utm_medium=referral&utm_campaign=fullarticle ","mpftjaua-1"
"34","startup","Uber to launch bike service in Amritsar and Kanpur","Ride-hailing startup Uber is planning to launch its bike service UberMOTO in Amritsar and Kanpur this weekend with cab services yet to be introduced in the cities. This comes after Uber dismissed reports of exit from India and assured 100% commitment. Currently Uber provides cabs, autorickshaws, outstation, and carpooling services in 29 Indian cities while bike services exist in nine.","http://images.newsinshorts.com.edgesuite.net/app_assets/images/2018/26jan/inshorts_image_1516951302296_237.jpg?resize=400px:*","https://inc42.com/buzz/uber-launch-bike-ubermoto/?utm_source=inshorts&utm_medium=referral&utm_campaign=fullarticle ","mpftjaua-1"
