"ind","catg","headline","body","imageurl","readmoreurl","inblockId"
"273","startup","Meal replacement startup Soylent's CEO steps down","US-based meal replacement startup Soylent's Co-founder Rob Rhinehart has stepped down from his role as the company's Chief Executive Officer. In a blogpost, Rhinehart said he will continue as Soylent's Executive Chairman. He also announced that Bryan Crowley, who was appointed the President of Soylent parent company Rosa Foods in June, will take over as the CEO.","http://images.newsinshorts.com.edgesuite.net/app_assets/images/2017/12dec/inshorts_image_1513086320316_103.jpg?resize=400px:*","https://techcrunch.com/2017/12/11/soylent-co-founder-rob-rhinehart-steps-down-as-ceo/?utm_source=inshorts&utm_medium=referral&utm_campaign=fullarticle ","6zegocdz-1"
"274","startup","Swiggy acqui-hires gourmet Asian food startup 48East","Bengaluru-based food delivery startup Swiggy has acqui-hired the management team of Bengaluru-based gourmet Asian food startup 48East. As part of the deal, 48East Founders Joseph Cherian and Nabhojit Ghosh will join the Swiggy team with Cherian as the COO of the 'New Supply' business line. Founded in 2016, 48East offers Asian dishes with a weekly changing menu.","http://images.newsinshorts.com.edgesuite.net/app_assets/images/2017/13dec/inshorts_image_1513169043303_428.jpg?resize=400px:*","https://inc42.com/buzz/swiggy-acqui-hire-48east-swiggy-access/?utm_source=inshorts&utm_medium=referral&utm_campaign=fullarticle ","6zegocdz-1"
"275","startup","Flipkart buys back employee stock options worth $100 million","Flipkart has completed its $100-million repurchase of employee stock options (ESOPs), the homegrown e-commerce giant said on Wednesday. The repurchase is reportedly the largest share buyback program in the history of the Indian startup ecosystem. More than 3,000 former and present employees of the Flipkart Group and group companies including Myntra participated in the repurchase, Flipkart said.","http://images.newsinshorts.com.edgesuite.net/app_assets/images/2017/13dec/inshorts_image_1513168759845_616.jpg?resize=400px:*","http://www.livemint.com/Companies/saABWcWVzJhlnT9vDTsJyH/Flipkart-completes-buyback-of-employee-stock-options-worth-.html?utm_source=inshorts&utm_medium=referral&utm_campaign=fullarticle ","6zegocdz-1"
"276","startup","Uber rider charged over ₹9 lakh for 21-minute ride in Canada","Ride-hailing startup Uber charged a rider over $14,400 (nearly ₹9.3 lakh) for a 21-minute, 8-kilometre ride last week in Toronto, Canada. As per Uber's official ride estimate tool, the 8-km trip should cost between $9 to $12. Uber confirmed the charge as an error and said that the rider has been issued a refund.","http://images.newsinshorts.com.edgesuite.net/app_assets/images/2017/11dec/inshorts_image_1513000321789_977.jpg?resize=400px:*","http://www.ibtimes.co.uk/this-insane-uber-charged-rider-over-14000-21-minute-ride-toronto-1650938?utm_source=inshorts&utm_medium=referral&utm_campaign=fullarticle ","6zegocdz-1"
"277","startup","Aamir Khan invests ₹2cr in furniture rental startup Furlenco","Actor Aamir Khan has invested ₹2 crore in Bengaluru-based online furniture rental startup Furlenco, according to filings. Last year, the startup raised ₹200 crore in equity and debt funding in a funding round led by LightBox Ventures. Founded in 2012, Furlenco allows users to rent furniture by the month.","http://images.newsinshorts.com.edgesuite.net/app_assets/images/2017/12dec/inshorts_image_1513091409244_609.jpg?resize=400px:*","http://www.timesnownews.com/business-economy/article/aamir-khan-invests-in-this-furniture-renting-startup/144586?utm_source=inshorts&utm_medium=referral&utm_campaign=fullarticle ","6zegocdz-1"
"278","startup","Video sharing startup Clip raises funds from Matrix, others","Bengaluru-based video sharing startup Clip App has raised an undisclosed amount of funding led by Matrix Partners India, the company has said in a statement. The Series A funding round also saw participation from existing investors Shunwei Capital and India Quotient. Founded in 2017, Clip allows users to create, edit and share short 60-second video clips in local languages. ","http://images.newsinshorts.com.edgesuite.net/app_assets/images/2017/14dec/inshorts_image_1513233172169_746.jpg?resize=400px:*","http://www.livemint.com/Companies/MNVNIub7QkUei9U7QJu1dK/Videosharing-firm-Clip-raises-funds-from-Matrix-others.html?utm_source=inshorts&utm_medium=referral&utm_campaign=fullarticle ","6zegocdz-1"
"279","startup","Startup Founder found dead in Mumbai","A 25-year-old female startup Founder has been found dead in a high-rise building in Malad, Mumbai. The body was found dangling from the duct area on the second floor of the building, according to reports. The woman who had founded an advertising solution startup was visiting her friends who stayed on the 15th floor of the building.","http://images.newsinshorts.com.edgesuite.net/app_assets/images/2017/12dec/inshorts_image_1513061872574_637.jpg?resize=400px:*","http://www.timesnownews.com/india/article/mumbai-malad-semi-nude-body-manavsthal-apartments-mahakali-road-malwani-suicide-arpita-tiwari-pankaj-jadhav-maharashtra/144627?utm_source=inshorts&utm_medium=referral&utm_campaign=fullarticle ","6zegocdz-1"
"280","startup","Pepperfry narrows losses to ₹128.8 crore in 2017 fiscal","Online furniture retailer Pepperfry has narrowed its losses to ₹128.8 crore in 2017 fiscal, as compared to ₹154.9 crore in the previous fiscal, according to filings. The startup also posted a revenue of ₹127.5 crore, a rise of 30% from the reported revenue of ₹98.2 crore last year. Founded in 2012, Pepperfry is backed by investors including Goldman Sachs.","http://images.newsinshorts.com.edgesuite.net/app_assets/images/2017/12dec/inshorts_image_1513097509263_315.jpg?resize=400px:*","http://www.livemint.com/Companies/YC3ylTaulGdo2KrmDcnXwJ/Pepperfrys-FY17-losses-narrow-to-Rs128-crore.html?utm_source=inshorts&utm_medium=referral&utm_campaign=fullarticle ","6zegocdz-1"
"281","startup","Elon Musk-backed payments startup launches beta in India","Billionaire Elon Musk-backed digital payments startup Stripe has launched its private beta version in India. The US-based startup has launched the invite-only service with a small group of companies to test the platform and get feedback on its features, the company said. Founded in 2010, Stripe is currently present in 25 countries.","http://images.newsinshorts.com.edgesuite.net/app_assets/images/2017/12dec/inshorts_image_1513098021340_551.jpg?resize=400px:*","https://inc42.com/buzz/digital-payments-stripe-india/?utm_source=inshorts&utm_medium=referral&utm_campaign=fullarticle ","6zegocdz-1"
"282","startup","Sales enabling startup MindTickle raises $27 mn in Series B","San Francisco and Pune-based sales enabling startup MindTickle has raised $27 million (over ₹174 crore) in a Series B funding round led by Silicon Valley-based VC firm Canaan Partners. Existing investors Accel Partners, New Enterprise Associates (NEA), and Qualcomm Ventures also participated in the round. Founded in 2011, MindTickle is a SaaS platform that focuses on improving sales of clients. ","http://images.newsinshorts.com.edgesuite.net/app_assets/images/2017/13dec/inshorts_image_1513168578789_139.jpg?resize=400px:*","https://inc42.com/buzz/mindtickle-canaan-partners-sales/?utm_source=inshorts&utm_medium=referral&utm_campaign=fullarticle ","6zegocdz-1"
"283","startup","We don't want to become a bank: MobiKwik Co-founder","When asked about expanding to a payments bank, MobiKwik Co-founder Upasana Taku in a recent interview said, ""We don't want to become a bank."" She adding that MobiKwik has moved from being a consumer payments brand to being a consumer fintech brand. ""We don't see any benefit in becoming a bank,"" she added. ","http://images.newsinshorts.com.edgesuite.net/app_assets/images/2017/10dec/inshorts_image_1512918801905_109.jpg?resize=400px:*","http://www.thenewsminute.com/article/see-no-merit-becoming-payments-bank-mobikwik-s-upasana-taku-72932?utm_source=inshorts&utm_medium=referral&utm_campaign=fullarticle ","6zegocdz-1"
"284","startup","Healthcare startup DocsApp raises $7.2 mn in Series A","Bengaluru-based online medical consultation startup DocsApp has raised $7.2 million in a Series A funding from Bessemer Venture Partners and Japanese investment firms, Techmatrix Corporation and DeNa Networks. It also saw participation from Facebook investors Anand Rajaraman and Venky Harinarayanan. Founded in 2013, the startup offers an app to connect doctors with patients in real time.","http://images.newsinshorts.com.edgesuite.net/app_assets/images/2017/13dec/inshorts_image_1513152940331_469.jpg?resize=400px:*","http://www.livemint.com/Companies/KMTcsku6LRIiqOe27LcljK/DocsApp-raises-72-million-from-Bessemer-Venture-Partners.html?utm_source=inshorts&utm_medium=referral&utm_campaign=fullarticle ","6zegocdz-1"
"285","startup","Japanese space startup raises $90.2 mn for Moon missions","Japanese space startup ispace has raised $90.2 million in the largest Series A funding to date in the global commercial space sector, the startup said. The amount will be used for the development of a lunar lander and conduct two lunar missions by 2020. Innovation Network Corporation of Japan and Suzuki Motor participated in the round.","http://images.newsinshorts.com.edgesuite.net/app_assets/images/2017/13dec/inshorts_image_1513151114024_793.jpg?resize=400px:*","https://www.forbes.com/sites/alexknapp/2017/12/13/this-japanese-space-startup-raised-90-2-million-to-go-to-the-moon/?utm_source=inshorts&utm_medium=referral&utm_campaign=fullarticle#1f56124176b6 ","6zegocdz-1"
"286","startup","Ratan Tata-backed premium tea startup Teabox raises $7 mn","Bengaluru-based premium tea selling startup TeaBox has raised $7 million in Series B funding from Singapore-headquartered venture capital firm RB Investments. As per reports, existing investors including Accel Partners also participated in the Ratan Tata-backed startup's funding. Founded in 2012 by Kaushal Dugar, TeaBox through its online platform sells teas from Darjeeling, Assam and Nilgiri.","http://images.newsinshorts.com.edgesuite.net/app_assets/images/2017/14dec/inshorts_image_1513231944289_733.jpg?resize=400px:*","https://inc42.com/buzz/teabox-rb-investments-funding/?utm_source=inshorts&utm_medium=referral&utm_campaign=fullarticle ","6zegocdz-1"
"287","startup","Cafe chain startup Chai Break raises ₹5 crore","Kolkata-based cafe chain startup Chai Break has raised ₹5 crore from incubator Venture Catalysts in exchange for 10% stake, the startup has confirmed. Chai Break has been valued at ₹50 crore after the first round of external funding, according to reports. Launched in 2011 by Anirudh Poddar and Aditya Ladsaria, Chai Break has 11 outlets in Kolkata, Durgapur, and Bhubaneswar. ","http://images.newsinshorts.com.edgesuite.net/app_assets/images/2017/12dec/inshorts_image_1513065300308_900.jpg?resize=400px:*","http://www.livemint.com/Companies/MAlugd9l6jAVAmqNTB6e0J/Venture-Catalysts-buys-10-stake-in-Chai-Break-for-Rs5-crore.html?utm_source=inshorts&utm_medium=referral&utm_campaign=fullarticle ","6zegocdz-1"
"288","startup","Uber's Head of Driver Product Aaron Schildkrout quits","US-based cab aggregator Uber's Head of Driver Product Aaron Schildkrout announced his departure from the company in an email to Uber staff on Wednesday. His departure comes after wrapping up the company's campaign to retain drivers on the platform. Schildkrout joined Uber in 2015 and he was previously the Co-founder of the online dating startup HowAboutWe. ","http://images.newsinshorts.com.edgesuite.net/app_assets/images/2017/14dec/inshorts_image_1513257438389_480.jpg?resize=400px:*","https://www.recode.net/2017/12/13/16772788/uber-driver-product-aaron-schildkrout-180-day-campaign?utm_source=inshorts&utm_medium=referral&utm_campaign=fullarticle ","6zegocdz-1"
"289","startup","Gaming startup Nazara raises $28 mn from Rakesh Jhunjhunwala","Mumbai-based mobile gaming company Nazara has raised $27.99 million (₹180 crore) from investor Rakesh Jhunjhunwala, who acquired a majority of its stake. Earlier, Nazara raised $51.1 million (₹330 crore) in funding led by IIFL Special Opportunities Fund. Founded in 2000, Nazara develops mobile games based on public personalities like cricketer Virat Kohli and cartoon series like 'Motu Patlu'.","http://images.newsinshorts.com.edgesuite.net/app_assets/images/2017/13dec/inshorts_image_1513145498995_579.jpg?resize=400px:*","https://inc42.com/buzz/rakesh-jhunjhunwala-gaming-nazara/?utm_source=inshorts&utm_medium=referral&utm_campaign=fullarticle ","6zegocdz-1"
"290","startup","Indian cryptocurrency exchange Koinex raises pre-Series A","Mumbai-based multi-cryptocurrency exchange Koinex has raised an undisclosed amount in pre-Series A funding. The amount has been raised from US-based investment firm Pantera Capital and Singapore-based company Beenext. Founded in 2017 by IIT alumni Rahul Raj and Rakesh Yadav, along with BITS Pilani alumnus Aditya Nayak, Koinex facilitates trading cryptocurrencies like Bitcoin and Ethereum.","http://images.newsinshorts.com.edgesuite.net/app_assets/images/2017/13dec/inshorts_image_1513169538213_307.jpg?resize=400px:*","https://inc42.com/buzz/koinex-cryptocurrency-exchange-funding/?utm_source=inshorts&utm_medium=referral&utm_campaign=fullarticle ","6zegocdz-1"
"291","startup","Online tea brand raises $1.4 mn led by Fireside Ventures","New Delhi-based online tea brand Vahdam Teas has raised $1.4 million (₹9 crore) in a funding round led by venture capital firm Fireside Ventures. The startup's existing investors including Singapore Angel Network and Mumbai Angels also participated in the round. Founded in 2015, the startup sources tea directly from plantations and delivers it to consumers across the world. ","http://images.newsinshorts.com.edgesuite.net/app_assets/images/2017/11dec/inshorts_image_1512996983217_523.jpg?resize=400px:*","https://inc42.com/buzz/vahdam-teas-fireside-ventures-funding/?utm_source=inshorts&utm_medium=referral&utm_campaign=fullarticle ","6zegocdz-1"
"292","startup","LeEco Founder blacklisted in China over unpaid debts","Chinese technology startup LeEco's Founder Jia Yueting has been placed on an official blacklist of debt defaulters after failing to comply with a court order. Yueting was ordered to pay about $71 million to investment firm Ping An Securities Group. Earlier in July, a Shanghai court froze $180 million in assets owned by Yueting, his wife, and LeEco's three subsidiaries.","http://images.newsinshorts.com.edgesuite.net/app_assets/images/2017/13dec/inshorts_image_1513174474314_379.jpg?resize=400px:*","https://www.reuters.com/article/us-leeco-debt/founder-of-chinas-embattled-leeco-placed-on-debt-blacklist-idUSKBN1E70DO?utm_source=inshorts&utm_medium=referral&utm_campaign=fullarticle ","6zegocdz-1"
"293","startup","Dairy-tech startup MilkLane raises $4 million","Mumbai-based dairy-tech startup MilkLane has raised $4 million in pre-Series A funding from Switzerland-based investment firm Pioneering Ventures. US-based firm Schreiber Foods and ultra-high net worth families also participated in the round. Founded in 2015, MilkLane procures milk from primary producers and supplies it to industrial processors, milk product manufacturers, and end consumers.","http://images.newsinshorts.com.edgesuite.net/app_assets/images/2017/9dec/inshorts_image_1512820588841_340.jpg?resize=400px:*","https://yourstory.com/2017/12/milklane-raises-4-m-in-seed-funding/?utm_source=inshorts&utm_medium=referral&utm_campaign=fullarticle ","6zegocdz-1"
"294","startup","Uber to settle US lawsuit filed by Indian rape victim","Uber has agreed to settle a lawsuit filed by an Indian woman in the US, accusing top company executives of improperly obtaining her medical records. The woman claimed the executives tried to obtain confidential records after a company driver in India raped her in 2014. The lawsuit filed in June also alleged that Uber kept a copy of the records.","http://images.newsinshorts.com.edgesuite.net/app_assets/images/2017/9dec/inshorts_image_1512826421720_435.jpg?resize=400px:*","https://www.reuters.com/article/us-uber-rape-settlement/uber-agrees-to-settle-u-s-lawsuit-filed-by-india-rape-victim-idUSKBN1E300T?feedType=RSS&feedName=worldNews&utm_source=Twitter&utm_medium=Social&utm_campaign=Feed%3A+Reuters%2FworldNews+%28Reuters+World+News%29&utm_source=inshorts&utm_medium=referral&utm_campaign=fullarticle ","blpq60zg-1"
"295","startup","Ola driver allegedly molests woman, holds her hostage","An Ola cab driver allegedly molested a 23-year-old student and used the car's child-lock to hold her hostage in the car in Bengaluru. The victim claimed that the cab driver threatened her over the phone and told her not to register a complaint. The driver was suspended from the platform immediately, Ola said in a statement. ","http://images.newsinshorts.com.edgesuite.net/app_assets/images/2017/6dec/inshorts_image_1512564978626_871.jpg?resize=400px:*","https://www.thequint.com/news/india/bengaluru-ola-driver-molests-woman-in-cab?utm_source=inshorts&utm_medium=referral&utm_campaign=fullarticle ","blpq60zg-1"
"296","startup","Will face gut-wrenching decade in autonomous cars: Lyft CSO","While talking about autonomous cars, Lyft's Chief Strategy Officer Raj Kapoor has said, ""We're going to go through a gut-wrenching decade"" before any firm takes the lead. He also said that Lyft has a chance to disrupt Google Maps as the leader in routing technology using the driving data collected by its drivers. ","http://images.newsinshorts.com.edgesuite.net/app_assets/images/2017/5dec/inshorts_image_1512479626826_622.jpg?resize=400px:*","https://www.youtube.com/watch?v=mUfMJu8LGcA&utm_source=inshorts&utm_medium=referral&utm_campaign=fullarticle ","blpq60zg-1"
"297","startup","Uber rival Lyft launches self-driving cars in Boston","Ride-hailing startup Lyft has launched its self-driving cars with the technology startup 'NuTonomy' in Boston, United States. The cars will be accompanied by human safety drivers to take control in case of an emergency. The ride-hail company is also working with self-driving car startup Drive.ai to deploy autonomous taxis in San Francisco city in the US. ","http://images.newsinshorts.com.edgesuite.net/app_assets/images/2017/7dec/inshorts_image_1512656564652_141.jpg?resize=400px:*","https://www.theverge.com/2017/12/6/16742924/lyft-nutonomy-boston-self-driving-car?utm_source=inshorts&utm_medium=referral&utm_campaign=fullarticle ","blpq60zg-1"
"298","startup","Faraday Future employee accused of sexual harassment","A Faraday Future employee has been accused by a former security guard of sexual harassment and online stalking in a lawsuit filed in June. She alleged that the employee repeatedly approached her at night and asked her for her personal information. The plaintiff also claims the company dismissed multiple reports about the alleged actions of the accused employee. ","http://images.newsinshorts.com.edgesuite.net/app_assets/images/2017/5dec/inshorts_image_1512454437931_365.jpg?resize=400px:*","https://www.theverge.com/2017/12/4/16734146/faraday-future-sexual-harassment-lawsuit-cyberstalking?utm_source=inshorts&utm_medium=referral&utm_campaign=fullarticle ","blpq60zg-1"
"299","startup","20-year-old man from US behind Uber data breach: Report","A man from Florida, United States is responsible for the 2016 data breach at Uber, which compromised the personal data of 57 million users, according to a report. The 20-year-old man was reportedly also paid by Uber to destroy the data through a bug bounty program. Uber disclosed the hack last month and admitted to paying the hacker $100,000.","http://images.newsinshorts.com.edgesuite.net/app_assets/images/2017/7dec/inshorts_image_1512628695527_164.jpg?resize=400px:*","https://www.reuters.com/article/us-uber-cyber-payment-exclusive/exclusive-uber-paid-20-year-old-florida-man-to-keep-data-breach-secret-sources-idUSKBN1E101C?utm_source=inshorts&utm_medium=referral&utm_campaign=fullarticle ","blpq60zg-1"
"300","startup","Startup develops urinal that serves ads while user urinates ","Netherlands-based startup Mr. Friendly has developed a urinal that displays advertisements while a user is urinating. The urinal comes with a built-in sensor that detects presence and only plays the advertisement if someone is standing in front of it. The media displayed on the urinal can also be controlled remotely.","http://images.newsinshorts.com.edgesuite.net/app_assets/images/2017/8dec/inshorts_image_1512742573050_307.jpg?resize=400px:*","https://thenextweb.com/shareables/2017/12/07/smart-urinal-ads-toilet/?utm_source=inshorts&utm_medium=referral&utm_campaign=fullarticle ","blpq60zg-1"
"301","startup","Musk responds to Boeing CEO's comment on reaching Mars first","SpaceX Founder Elon Musk has responded to Boeing CEO Dennis Muilenburg, saying ""Do it"" after he commented that the aerospace company will beat Musk to reach Mars. ""The first person that sets foot on Mars will get there on a Boeing rocket,"" Muilenburg said on Thursday. In September, Musk unveiled a detailed plan to build a human colony on Mars.","http://images.newsinshorts.com.edgesuite.net/app_assets/images/2017/8dec/inshorts_image_1512738725658_914.jpg?resize=400px:*","http://fortune.com/2017/12/07/elon-musk-boeing-mars/?utm_source=inshorts&utm_medium=referral&utm_campaign=fullarticle ","blpq60zg-1"
"302","startup","Startup develops pillow-like robot to improve sleep","Netherlands-based startup Somnox has developed a 'sleep robot', which it claims can improve a user's sleep through its 'breathing' rhythm. The technology makes the pillow-like device fall and rise, providing the user with a breathing sensation. The app-connected device can also play the sound of heartbeats and music, which automatically turns off after the user falls asleep.","http://images.newsinshorts.com.edgesuite.net/app_assets/images/2017/9dec/inshorts_image_1512800786374_765.jpg?resize=400px:*","https://www.kickstarter.com/projects/somnox/somnox-worlds-first-sleep-robot-to-improve-your-sl?utm_source=kickbooster&utm_medium=redirect&utm_content=link&utm_campaign=2e2264&utm_source=inshorts&utm_medium=referral&utm_campaign=fullarticle ","blpq60zg-1"
"303","startup","In 2 or 3 yrs we’ll have first flying taxis: Volocopter","Volocopter's Co-founder Alex Zosel has said that in two or three years the German aviation startup will have its first commercial applications ""somewhere in the world."" Zosel added that the first commercial application will be a 'point to point' solution over bottlenecks such as traffic congestions. The startup's aircrafts will fly at an airspeed of 100 kmph.","http://images.newsinshorts.com.edgesuite.net/app_assets/images/2017/6dec/inshorts_image_1512543929506_127.jpg?resize=400px:*","https://techcrunch.com/2017/12/05/volocopter-expect-our-flying-taxis-running-for-real-in-two-to-three-years/?utm_source=inshorts&utm_medium=referral&utm_campaign=fullarticle ","blpq60zg-1"
"304","startup","Facebook Co-founder's firm invests in Indian startup Mswipe","Facebook Co-founder Eduardo Saverin's venture capital firm B Capital has led a $10 million Series D funding round in Mumbai-based mobile point-of-sale services startup Mswipe. Existing investor DSG Consumer Partners also participated in the round, the startup said in a statement. The funding round took the total funding raised by the startup in series D round to over $40 million.","http://images.newsinshorts.com.edgesuite.net/app_assets/images/2017/7dec/inshorts_image_1512656911320_713.jpg?resize=400px:*","https://inc42.com/buzz/mswipe-funding-b-capital-series-d/?utm_source=inshorts&utm_medium=referral&utm_campaign=fullarticle ","blpq60zg-1"
"305","startup","Uber sells 51% stake of Singapore business to ComfortDelGro","Singapore-headquartered transport company ComfortDelGro has agreed to acquire 51% stake in Uber-owned car rental subsidiary, Lion City Holdings in Singapore. The deal will be valued at about $474 million, making it ComfortDelGro's largest deal to-date. The deal will also allow ComfortDelGro's taxi drivers to receive ride requests on Uber's app.","http://images.newsinshorts.com.edgesuite.net/app_assets/images/2017/8dec/inshorts_image_1512739516196_741.jpg?resize=400px:*","https://techcrunch.com/2017/12/08/uber-comfortdelgro-singapore/?utm_source=inshorts&utm_medium=referral&utm_campaign=fullarticle ","blpq60zg-1"
"306","startup","Sarahah will be introduced in Indian languages, says Founder","Sarahah's Founder ZainAlabdin Tawfiq has said that the anonymous feedback platform will be introduced in many languages, including those used in India. Adding that he has always been fascinated with India, he said India will be a key zone for expansion. Recently, the Delhi High Court sought to ban anonymous sites like Sarahah that are used to send abusive messages.","http://images.newsinshorts.com.edgesuite.net/app_assets/images/2017/7dec/inshorts_image_1512654463445_823.jpg?resize=400px:*","http://www.hindustantimes.com/tech/sarahah-will-soon-be-available-in-indian-languages-founder-zain-alabdin-tawfiq/story-5xigDXAJymJaBk3z2B2ePK.html?utm_source=inshorts&utm_medium=referral&utm_campaign=fullarticle ","blpq60zg-1"
